,recommendationid,language,review,timestamp_created,timestamp_updated,voted_up,votes_up,votes_funny,weighted_vote_score,comment_count,steam_purchase,received_for_free,written_during_early_access,author.steamid,author.num_games_owned,author.num_reviews,author.playtime_forever,author.playtime_last_two_weeks,author.playtime_at_review,author.last_played
75,76939141,english,Squad based shooter with no party or squad system prior to joining a server.,1601683691,1601683691,False,0,0,0.47826087474822998,0,True,False,False,76561198013924906,218,25,225,194,160,1601686588
76,76935640,english,"If you want to play a game that you sit back, relax and play this isn't it. This game is unforgiving and will take some time to learn.",1601677569,1601677569,True,0,0,0,0,True,False,False,76561198209521489,63,1,2550,1873,2117,1601713157
77,76935286,english,get fucked charles,1601676985,1601676985,True,0,0,0,0,True,False,False,76561198046505599,363,5,5220,929,4664,1601970828
78,76933548,english,"I love this game bb UwU
",1601674158,1601674158,True,0,0,0,0,True,False,False,76561198076230407,232,48,3051,120,2931,1601748674
79,76933129,english,YOU RUNNING SCARED CHARLIE ????????????????????????????????????????????????????????????????????????????????????,1601673468,1601673468,True,0,0,0,0,True,False,False,76561198061386399,244,19,2701,0,2701,1590640595
80,73449255,english,"Great Game. Level 95 at this point. Very addictive.  If you want a good experience, stay away from RD 24/7 RESORT SERVER. The admins are young immature kids who hack and cheat. Very toxic behavior. They will boot you from server for no reason other than immaturity",1595999658,1601667201,True,2,0,0.523809552192687988,0,True,False,False,76561198074263198,72,2,133850,2051,133074,1602079241
81,76925795,english,I KILL GI! GI SMALL PP,1601663541,1601663541,True,0,0,0,0,True,False,False,76561198203997223,47,4,2803,2803,1815,1602039442
82,76923658,english,awesome experience,1601660779,1601660779,True,0,0,0,0,True,False,False,76561198012073071,55,1,1794,1558,1139,1602089614
83,76921035,english,very good game nice graphics nice gameplay and perfect TTK,1601657573,1601657573,True,0,0,0,0,True,False,False,76561198389775773,46,14,8374,952,8169,1602057651
84,76914092,english,Good game and great community,1601648830,1601648830,True,0,0,0,0,True,True,False,76561198354580809,20,2,6748,277,6687,1602090083
85,76913252,english,"Challenging, but fun with friends.",1601647713,1601647713,True,0,0,0,0,True,False,False,76561198038739800,174,10,2089,323,1964,1601765977
86,76912364,english,Great Game!,1601646524,1601646524,True,0,0,0,0,True,False,False,76561197982170094,172,3,8265,813,7717,1601848887
87,76905969,english,when that flanking flamethrower guy stepped on your punji,1601636090,1601636981,True,0,0,0,0,True,False,False,76561198188187390,160,12,5661,31,5630,1601639541
88,76899225,english,You can kill a lot of communists in this game,1601623146,1601623146,True,0,0,0,0,True,False,False,76561198068277024,68,10,11778,0,11778,1568928694
89,76893124,english,"Ive played pretty much everything ""shooter"" related but this game is 1000000000000000000% the perfect mix of real and arcade filled chaos 10/10
",1601611271,1601611271,True,0,0,0,0,True,False,False,76561198990132197,44,1,2410,1793,1902,1602052495
90,76891887,english,"yes
",1601608637,1601608637,True,0,0,0,0,True,False,False,76561198153545941,64,8,9316,141,9276,1601709826
91,76890301,english,Anti ASS Defenses are active,1601605495,1601605495,True,0,0,0,0,True,False,False,76561198196346509,13,1,2855,344,2613,1602065178
92,53155867,english,"It's like CoD, Battlefield and Squad had some kind of buggy, orgy baby together. 

I love it.",1562075724,1601605249,True,1,0,0.523809552192687988,0,True,False,False,76561198862386180,250,4,74669,1760,74135,1602022441
93,76889097,english,a great balance between realisim and arcade,1601603222,1601603222,True,0,0,0,0,True,False,False,76561198880557169,28,1,1877,1877,1210,1602067297
94,76888501,english,good game,1601602092,1601602092,True,0,0,0,0,True,False,False,76561198053767673,94,4,6342,28,6332,1601602670
95,76887908,english,o0o0o0o,1601600899,1601600899,True,0,0,0,0,True,False,False,76561198186917394,18,7,4580,4580,2214,1602013274
96,76886745,english,A very good game. Unfortunately devs left or something but the game itself is still good.,1601598508,1601598508,True,1,0,0.523809552192687988,0,True,False,False,76561198263298226,27,1,9647,0,9647,1597352935
97,76886489,english,gives ptsd would play again,1601597885,1601597885,True,0,0,0,0,True,False,False,76561198274743717,61,7,7732,1013,6901,1601950730
98,76883415,english,They're in the trees man!!!,1601591320,1601591417,True,0,0,0,0,True,False,False,76561198021264742,243,11,2100,149,1950,1601609656
99,76881198,english,"simple, fun game",1601587078,1601587078,True,0,0,0,0,True,False,False,76561198370495114,43,5,1004,269,864,1601743904
0,76880200,english,"Great game overall, really good gunplay apart from when the SKS reload animation doesn't go through and i want too put a hole in my screen. nailed the realism when going through the jungles, get scared s***less when a half naked Vietnamese guy knifes you in the gut :)",1601585389,1601585389,True,0,0,0,0,True,False,False,76561199045354304,5,1,421,325,394,1601839486
1,76879432,english,bing bong ming mao as my friend says,1601584048,1601584048,True,0,0,0,0,True,False,False,76561198302704135,82,13,354,38,316,1601586315
2,76876768,english,Epic Cash Money love it when the trees talk veitnamese,1601580095,1601580095,True,0,0,0,0,True,False,False,76561198361191622,44,14,154,0,154,1600703548
3,76875627,english,An excellent example of how a War game should be setup.,1601578546,1601578546,True,0,0,0,0,True,False,False,76561197965770637,149,1,51023,1499,50402,1602024560
4,76874525,english,Poorly aged graphics and gameplay that's nowhere near as fun as Insurgency. This game just feels like a drag.,1601576987,1601576987,False,1,0,0.47413790225982666,0,True,False,False,76561198063184762,173,3,286,0,286,1593766673
5,76869090,english,"""their in the trees""

10/10",1601569787,1601569787,True,0,0,0,0,True,False,False,76561198371319288,29,1,17962,23,17938,1601572140
6,76860942,english,"Good Game
",1601558780,1601558780,True,0,0,0,0,True,False,False,76561198400119693,45,5,1999,67,1936,1601629983
7,76856841,english,"as long as you dont get mad when you die to something you cant see, the learning curve for this game isnt that painful. then its just pure clean tactics and killin jippos. the shooting feels great, the maps are built well, the gamemodes are fun. the quick match function doesnt seem to work rn but its not very hard to find a server manually at all",1601551708,1601551708,True,0,0,0,0,True,False,False,76561198100948878,163,10,2821,690,2441,1602089895
8,76850844,english,"Này Công Dân ơi! Quốc gia đến ngày giải phóng
Đồng lòng cùng đi hy sinh tiếc gì thân sống.
Vì tương lai Quốc Dân, cùng xông pha khói tên,
Làm sao cho núi sông từ nay luôn vững bền.
Dù cho thây phơi trên gươm giáo,
Thù nước, lấy máu đào đem báo.
Nòi giống lúc biến phải cần giải nguy,
Người Công Dân luôn vững bền tâm trí.
Hùng tráng quyết chiến đấu làm cho khắp nơi
Vang tiếng người nước Nam cho đến muôn đời!
Công Dân ơi! Mau hiến thân dưới cờ!
Công Dân ơi! Mau làm cho cõi bờ
Thoát cơn tàn phá, vẻ vang nòi giống
Xứng danh nghìn năm dòng giống Lạc Hồng!",1601539089,1601539199,True,0,0,0,0,True,False,False,76561198099160920,47,1,13187,2704,11528,1602087738
9,76840127,english,"BE ADVISED WE'VE GOT ZIPS IN THE WIRE DOWN HERE!!!
",1601516963,1601516963,True,1,0,0.523809552192687988,0,True,False,False,76561198382260609,52,3,5427,7,5427,1601086783
10,76831937,english,verynice PTSD simulator,1601501248,1601501248,True,1,0,0.523809552192687988,0,True,False,False,76561198075703054,109,1,304,170,228,1601505794
11,76827988,english,"Despite playing the same map hundreds of times, every game offers a different experience. The graphics, despite being an older release, are still amazing today. There are so many different ways to enjoy this game and you won't feel sad getting killed by a higher level because ranking up only unlocks cosmetic items. The detail put into the maps put games today to shame. If you're into FPS games and/or history, this game will feel right at home in your steam library.",1601495072,1601495072,True,0,0,0,0,True,False,False,76561198355001044,16,4,5141,703,5085,1602049242
12,76811473,english,Kill fat Americans,1601473303,1601473303,True,1,0,0.425051331520080566,0,True,False,False,76561198047287276,88,14,13621,226,13605,1601650479
13,76806026,english,The PTSD simulator that I didn't know I wanted until I had it,1601464195,1601464195,True,0,0,0,0,True,False,False,76561198038158207,67,9,67442,4365,65251,1602077345
14,76796727,english,a lot of technical fun,1601442384,1601442384,True,0,0,0,0,True,False,False,76561198143711053,32,1,3769,1212,3184,1601765808
15,76793646,english,"to enjoy this game, I find that you can't play with a cs, r6 or cod mindset. you need to play slowly and push with your team. takes a certain appreciation of the realism to play properly",1601435463,1601435463,True,0,0,0,0,True,False,False,76561198400985710,66,29,151,129,138,1601699121
16,76792591,english,killin is fun,1601433193,1601433193,True,0,0,0,0,True,False,False,76561198067071526,65,4,2476,46,2439,1601460399
17,76791915,english,fuckin good game,1601431659,1601431659,True,0,0,0,0,True,False,False,76561198286551432,28,4,1211,83,1180,1601451149
18,76785724,english,"This game may have you sayin' things like ""Good Morning Vietnam,"" or, ""Get Some;"" faster than you can say ""F.U.B.A.R."" In all seriousness though there is hyper-realistic magic happening in this game,  making it really fun and exciting in my opinion. Keep your heads down and enjoy.",1601419219,1601419219,True,7,0,0.577496111392974854,0,True,False,False,76561199023239621,16,5,252,252,204,1601538466
19,76785029,english,good,1601417999,1601417999,True,0,0,0,0,True,False,False,76561198095784054,233,21,366,0,366,1565561935
20,76783924,english,Authentic and fun,1601416108,1601416108,True,0,0,0,0,True,False,False,76561198062287527,220,4,10341,195,10152,1601780412
21,76783405,english,Addictive realistic combat that scratches that 'Nam itch.,1601415164,1601415164,True,0,0,0,0,True,False,False,76561199012055469,20,3,1269,1269,733,1601832148
22,76782978,english,"Regardless of the community of idiots, and the fact that the developer has abandoned the game, I would say this is a good successor to Red Orchestra 2.  It wasn't too good a release, and there were promises that weren't met, but what we have currently is much better than nothing.",1601414478,1601414478,True,0,0,0,0,True,False,False,76561198037181365,74,7,11344,0,11344,1600863740
23,76781768,english,Shoot the trees.,1601412558,1601412558,True,0,0,0,0,True,False,False,76561198018644143,170,6,9972,446,9741,1602033488
24,76780900,english,penis,1601411333,1601411333,True,0,0,0,0,True,False,False,76561198068908841,70,1,9025,58,8966,1601414859
25,76773871,english,Its a bit tough to learn but its both fun and engaging. Highly recommend. :),1601401835,1601401835,True,0,0,0,0,True,False,False,76561198176260314,73,9,1872,113,1870,1601402799
26,76772287,english,Get the satisfaction of killing minorities in a war that the US of A didn't lose.,1601399800,1601399800,True,0,0,0,0,True,False,False,76561199015346002,28,6,2529,192,2529,1601399731
27,76770881,english,it good,1601398073,1601398073,True,0,0,0,0,True,False,False,76561199013684648,21,1,2328,108,2237,1602009557
28,76770386,english,"hehe 69 hours


oh yeh uuuh helis r cool :)",1601397421,1601397421,True,1,0,0.523809552192687988,0,True,False,False,76561198073831441,147,5,4463,509,4133,1601995286
29,76758680,english,"yes
",1601381625,1601381625,True,0,0,0,0,True,False,False,76561198408436462,5,1,1031,630,461,1602080817
30,76752441,english,I love the smell of napalm in the morning,1601368967,1601368967,True,0,0,0,0,True,False,False,76561198156245564,64,7,8524,1828,7575,1601868036
31,76750495,english,BRETTY GUD IF YOU GET SUM BOYS. CLIENT IS A PAIN IN THE BUTTHOLE,1601364326,1601364326,True,0,0,0.476190477609634399,0,True,False,False,76561198044598334,59,2,1137,158,1137,1601361513
32,76744528,english,"Smh how does my grandfather come back with PTSD? 

The Vietnam war was some of the most fun I've ever had",1601350524,1601350524,True,0,0,0,0,True,False,False,76561198305499155,150,48,12313,926,12069,1601364988
33,76744067,english,SPIDER HOLES MMMMM,1601349511,1601349511,True,0,0,0,0,True,False,False,76561198384429940,25,2,842,842,378,1601925804
34,76743231,english,"Very clunky game. Feels like a less polished battlefield 2. Like the realism, but very dated physics and graphics.  Would recommend waiting for the next iteration of battlefield vietnam.",1601347686,1601347686,False,0,0,0.476190477609634399,0,True,False,False,76561198011235809,49,10,18,6,18,1601343515
35,76741933,english,Yes,1601345170,1601345170,True,0,0,0,0,True,False,False,76561199088998653,9,1,1306,1093,357,1602042820
36,76741267,english,this game fun af,1601343892,1601343892,True,0,0,0,0,True,False,False,76561198205364977,67,5,4994,692,4765,1602023272
37,76739137,english,"Something for all FPS fans! Big battles across open maps, close-quarter combat in the buildings and city streets.

Different classes allow you to play to your strengths (I'm not great in twitchy close-quarter combat so I tend to use ranged weapons, or go in as a sapper and set traps). A good server will make or break the experience - support Strayagaming if you're in the Asia-Pacific region because they host a great community down here!",1601339759,1601339759,True,0,0,0,0,True,False,False,76561199074555598,7,2,1004,916,460,1602067441
38,76738933,english,Made my PTSD fun,1601339340,1601339340,True,0,0,0,0,True,False,False,76561197978573269,119,4,885,69,867,1601866880
39,76731746,english,"oh my lord
",1601326650,1601326650,True,0,0,0,0,True,False,False,76561198078651823,54,3,3842,75,3777,1601747792
40,55113950,english,"You can probably watch youtube to see how the game is, the concpet is ok, though colisions are cluncky af and you will often find yourself stuck against something and die in the process. You will die a lot and skill had nothing to do with that, you know, war is about luck. Untill you learn the maps and cheese strats of camping, it's not going to be any fun at all. Great experience, PTSD guaranteed. What makes it even better is the players that sing nazi songs over voip, spam racist banter or pretend to be middle-eastern insurgents. Ever wanted to hear a recording of Htiler's speach, but it's banned in your country? This game has you covered. Are you sad that you get banned because of oppressing minorieties in other games? Here is your anwser! 

It's basically 4chan - The Game, so if you are into this, go ahead and dump your hard earned money on this slav-af jank simulator - the best Vietnam game ever, which says a lot about the quality of the titles with that theme.

10/10 We live in a societey
Bottom Text.

EDIT: It seems time has passed and the more toxic part of the community moved on, but the rest of the experience is unchanged. You still will die a lot, camping is the best strategy and unless you have a well coordinated team, you will be counting losses. That said, the game can be quite enjoyable under the right conditions, and the raw brutality of the combat actually makes for an authentic Vietnam experience, just prepare to die a lot.",1568497362,1601321327,False,3,2,0.466163992881774902,0,True,False,False,76561197992408576,545,41,3562,157,2511,1601668767
41,76725422,english,GG,1601318068,1601318068,True,0,0,0,0,True,False,False,76561198418954872,47,5,335,115,288,1601515540
42,76724144,english,"If you like hardcore FPS and vietnam, this game is for you.",1601316471,1601316471,True,0,0,0,0,True,False,False,76561198019546707,209,26,3939,211,3879,1601320151
43,76715902,english,"good game very few servers tho.
",1601306302,1601306302,True,0,0,0,0,True,False,False,76561198355962888,29,15,1087,957,262,1601938149
44,67225085,english,Yes,1586779856,1601305803,True,0,0,0,0,True,False,False,76561198086706362,9,1,3553,1044,2628,1602085688
45,76713598,english,"Welcome to ""Where did I get shot from?"" simulator.",1601303506,1601303506,True,0,0,0,0,True,False,False,76561198864491668,51,1,8971,460,8872,1601310588
46,76711692,english,Rice fields.,1601301171,1601301171,True,1,0,0.527559041976928711,0,True,False,False,76561198036051115,108,19,2848,339,2630,1601992525
47,76704922,english,War crimes and racism simulator. I give it 9 out of 10 YAAAAA,1601290090,1601290090,True,0,0,0,0,True,False,False,76561198011213326,269,5,27376,0,27376,1556332632
48,76703166,english,team kill and PTSD simulator,1601286508,1601286508,True,0,0,0,0,True,False,False,76561198798978704,126,1,4558,1250,3856,1601972379
49,76693301,english,FRICKEN AWESOME GAME.,1601264278,1601264278,True,0,0,0,0,True,False,False,76561198322412284,41,4,602,527,320,1601614576
50,76690829,english,It's aight,1601259351,1601259351,True,0,0,0,0,True,False,False,76561199004789996,9,2,2517,2208,1852,1601781910
51,76683828,english,Amazing game. One of my favorites by far.,1601246453,1601246453,True,0,0,0,0,True,False,False,76561198210174076,69,8,6224,557,5867,1601876128
52,76681370,english,Solid game. Graphics aren't the best but oh well. Good gameplay.,1601242577,1601242577,True,0,0,0,0,True,False,False,76561198240442698,37,2,358,230,306,1601245699
53,76677759,english,"This game is the better version of battlefield, real life gunplay, recoil, weight, and damage models. Highly recommend this game over battlefield titles if large, realistic battles are what you want.",1601237619,1601237619,True,0,0,0,0,True,False,False,76561198425427644,17,1,5767,5261,2036,1602015828
54,76676298,english,Good game. Never passed boot camp though.,1601235868,1601235868,True,0,0,0,0,True,False,False,76561197994331118,204,2,5323,248,5189,1601735305
55,76669139,english,"Looking forward to '83!
This game is still fun despite the fact that it has aged. If you love committing in-game warcrimes you should  consider buying this game.",1601227394,1601227394,True,0,0,0,0,True,False,False,76561198382424412,31,13,3882,0,3882,1599823578
56,76665526,english,"One of the best tactical and realistic war FPS!
64 players in a big map, filled with so much chaos and fun. 
It's not too fast paced like battlefield and isn't too slow-paced like Arma. It's got that sweet middle ground.
The Community and the voice-chat in this game are the cherries on the top!

Just be ready to die a lot, ( from the enemy and sometimes from your commander placing a Napalm on your location) but also have patience and this game becomes very enjoyable and fun :D",1601223166,1601223166,True,0,0,0,0,True,False,False,76561198879404959,40,13,10243,1148,9349,1602089832
57,76660479,english,"it has great tactical gameplay
",1601217412,1601217412,True,0,0,0,0,True,False,False,76561198260839794,65,11,549,412,215,1601492573
58,76655407,english,GHF,1601211181,1601211181,True,0,0,0,0,True,True,False,76561198115957916,54,10,1497,409,1088,1601875946
59,76652490,english,great game to play. worth every penny,1601207154,1601207154,True,1,0,0.523809552192687988,0,True,False,False,76561198183591811,9,2,79141,0,79141,1598654268
60,76646751,english,"One of the best shooters out there. ""Hardcore"" shooter with steep learning curve and thus not for everyone. If you are looking for something between military sim and run-and-shoot game which is casual enough but with enough depth into it then this game might be worth looking at. Very loyal player base with a good amount of servers full at all times and good community.",1601199008,1601199008,True,0,0,0,0,True,False,False,76561197985593637,280,8,6256,262,6094,1601715068
61,76642368,english,"One of the best shooters I've ever played, brilliant mix of arcade and ""realism"" shooters. Well done, would recommend to anyone who wants to get into realistic shooters and is coming from more arcade-like stuff.",1601191564,1601191564,True,0,0,0,0,True,False,False,76561198048209509,232,32,9222,70,9151,1601345889
62,76641289,english,"Its pretty cool you get to go to the rice fields and kill the GI
",1601189600,1601189600,True,0,0,0,0,True,False,False,76561199013699754,41,6,1013,570,1013,1601048773
63,76639000,english,You can cook asian people.,1601185174,1601185174,True,0,0,0,0,True,False,False,76561198880601340,27,2,4184,1108,3597,1602041374
64,76638969,english,good game (Y),1601185127,1601185127,True,0,0,0,0,True,False,False,76561198090965996,20,1,2726,9,2716,1601185659
65,76636017,english,"terrible graphics, very clunky also",1601179573,1601179573,False,0,0,0,0,True,False,False,76561198323807265,22,10,40,40,40,1601179444
66,76633959,english,cool game don't be colorblind and ben,1601175862,1601175862,True,0,0,0,0,True,False,False,76561198243340324,35,16,2210,530,1886,1601842582
67,76631090,english,i now have ptsd,1601170902,1601170902,True,1,0,0.523809552192687988,1,True,False,False,76561198040908066,105,3,776,482,416,1601526802
68,76630358,english,"They've updated this game and it makes Unreal Engine 3 still look modern. Great mechanics, I didn't think I'd have this much fun playing a game originating in 2011 (RO2)",1601169622,1601169622,True,0,0,0,0,True,False,False,76561197997672686,114,13,6497,852,5918,1601612794
69,76628477,english,"Excellent shooter, realistic gunplay, teams are very important",1601166312,1601166312,True,0,0,0,0,True,False,False,76561198008159031,149,4,6915,482,6553,1602049797
70,76626473,english,One of the best war simulating games Ive ever played,1601162985,1601162985,True,0,0,0,0,True,False,False,76561198064234953,60,1,3368,2318,1607,1601971499
71,76619843,english,"the trees speak some vietnamese, the G.I. go home, and it smells like napalm in the morning.  in the words of sgt. lincoln osiris ""survive.""",1601153657,1601153657,True,0,0,0,0,True,False,False,76561198116752642,72,16,10709,1050,10160,1602019029
72,76618073,english,"After getting a new steam account I just could not help myself and spend so much time on this game. This era really sets it for me. Even when it acts funny sometimes I can look past it with a laugh =) 

Can't wait for '83 to come out!",1601151526,1601151526,True,0,0,0,0,True,True,False,76561198257290213,60,1,59347,236,59306,1601407000
73,76614547,english,This game is a complete disaster!!!! I was hoping for a more Battlefield 4 type of game play!!!!! So disappointed!!!!!!! I just don't like being told what weapon I have to use and that's why I give this game 0 out of 10!,1601147274,1601147274,False,1,2,0.461538463830947876,1,True,False,False,76561198154092922,10,2,407,407,233,1601225302
74,76612522,english,"For some reason, i played this more than Rising Storm/Red Orchestra 2.

Its simple. It has both the fun of the BF series and the realism of a RS game.

Balanced gameplay (cough) bugs (cough)

The fact that capturing points are really rewarding and contribute in the long campaign of your game.

Can't recommend enough if u are a SEA player there's actual active community here. Don't wait anymore GI.

GO BACK 'HOME' GI",1601145021,1601145021,True,0,0,0,0,True,False,False,76561198055760085,299,8,2832,617,2693,1601740159
75,76602043,english,"You ether make GI go Home..



Or you kill the communist rice people",1601133086,1601133086,True,0,0,0,0,True,False,False,76561199046769047,13,5,1145,95,1050,1601917053
76,76601138,english,"I have had problems starting the game. sometimes it crashes on startup and sometimes steam seemingly doesn't want to even try running it. Every time it crashes i have to restart my PC in order to be able to try starting the game again. if it fails, you go for another restart.

I have managed to play a few minutes of gameplay however. I'm a Battlefield player at heart and so the gameplay translates well to me. that said, it's horribly optimized. My PC exceedes minimum requirements in all aspects, some more than others, yet even at lowest graphics i can't get a stable 50 fps. and the graphics at lowest look horrendous. Like, just cause 2 level of terribleness, from a game that came out 10 years after that one.

I have looked for solutions for the crashing online but haven't been able to find a fix. As far as i can tell everyone is having crashing problems, just that some experience them more than others.

I might try the game when i have a better PC, but for now this is a refund and a hard 'don't recommend' from me.",1601131981,1601131981,False,0,0,0,0,True,False,False,76561198237796512,39,30,36,36,36,1601131241
77,76594222,english,"Because playing as a tree is fun gameplay
",1601123643,1601123643,True,0,0,0,0,True,False,False,76561198162330497,51,15,1783,74,1709,1601808119
78,76593046,english,G.I. GO HOME!!,1601122225,1601122225,True,0,0,0,0,True,False,False,76561198032596728,87,25,2384,1407,1351,1601907109
79,76585352,english,really fun,1601111053,1601111053,True,0,0,0,0,True,False,False,76561198391871368,47,10,4145,2592,2846,1601834303
80,76580845,english,i like it alot,1601103604,1601103604,True,0,0,0,0,True,False,False,76561198991932443,35,2,1656,525,1482,1601609473
81,76579827,english,its a relly good game,1601101858,1601101858,True,0,0,0,0,True,False,False,76561198353483299,36,8,626,626,320,1601528414
82,76570667,english,"Tão bom quanto o primeiro Rising Storm. Muito realista, sons muito realistas. Quando você dispara o m16, a ak-47, ou até mesmo uma .50, você sente que está disparando na vida real. As explosões então? Meu amigo, você chega a se abaixar no quarto. Recomendo muito!",1601086402,1601086402,True,0,0,0,0,True,False,False,76561198405304303,20,2,3728,3728,666,1602023646
