,recommendationid,language,review,timestamp_created,timestamp_updated,voted_up,votes_up,votes_funny,weighted_vote_score,comment_count,steam_purchase,received_for_free,written_during_early_access,author.steamid,author.num_games_owned,author.num_reviews,author.playtime_forever,author.playtime_last_two_weeks,author.playtime_at_review,author.last_played
0,77186359,english,"good game, maybe should bring back bots like in RO2 but mechanics and gameplay are great",1602087930,1602087930,True,0,0,0,0,True,False,False,76561198273489805,23,1,1291,70,1269,1602089156
1,77180674,english,"Games like this are the reason people are playing more single player games. We cant make a good anti-cheat engine that actually stops cheating? Really? Between the spawn camping, the absolute WORST community, and rampant cheating, and getting shot in the head over and over again from 300 yrds the second you spawn is not fun. Nothing about this game is fun.",1602080830,1602080830,False,0,0,0,0,True,False,False,76561198022648821,391,45,3324,17,3324,1602080598
2,77164901,english,"Ptsd.  Crazy fear of trees now. cannot leave home.  

Best large scale fps ive ever played.",1602054853,1602054853,True,0,1,0,0,True,False,False,76561198152230178,118,5,8143,300,8083,1602059415
3,77162021,english,"fun, semi-realistic, a little janky",1602048762,1602048762,True,0,0,0,0,True,False,False,76561198073913404,33,18,1565,24,1565,1602048710
4,77160848,english,yes,1602046290,1602046290,True,0,0,0,0,True,False,False,76561198078893490,84,1,2771,468,2765,1602079151
5,77159777,english,"""Please describe what you disliked about this product.""  

Hit detection, accuracy is bull  crap, spray n pray to win, unless you have a scope.",1602044127,1602044127,False,0,0,0.476190477609634399,0,True,False,False,76561199057575710,18,1,300,45,300,1602043967
6,77159735,english,"great great great great game
",1602044044,1602044044,True,0,0,0,0,True,False,False,76561198203351212,45,1,2804,1343,2768,1602046190
7,77159357,english,"great game very fun, dont be sweaty",1602043299,1602043299,True,0,0,0,0,True,False,False,76561198817987792,26,3,2752,140,2752,1601690333
8,77159198,english,It's pretty fun,1602042978,1602042978,True,0,0,0,0,True,False,False,76561198020518445,238,3,177124,2738,177124,1602039193
9,77158386,english,"Its a great game, amazing gameplay, good weapon physics, it takes a bit to learn to fly helicopters, but you'll get the hang of it.",1602041395,1602041395,True,0,0,0,0,True,False,False,76561198106474742,53,26,232,0,232,1582158682
10,77156534,english,It's all fun and games until someone is blasting Hanoi Hannah in the proximity chat and you are all alone. 10/10 will die again,1602037765,1602037765,True,0,0,0,0,True,False,False,76561199088667648,12,1,331,318,248,1602042787
11,77146220,english,"You're going to die. Mr. Ricehat with the Ak-47 does not care about your goddamn feelings ,and Mrs. RPG-7 doesn't give a fuck about your fucking cover or your fancy ass Huey. And when your teammates run in front of your M16 going off on some shit eating Charlies and if they get butthurt and try to game kick/end your ass ,fucking do it again. You are going to die by napalm, you are going to witness your entire fucking team get wiped out by Napalm. Why you might ask Mr. GI well the answer is simple YOUR COMMANDER IS A DUMBASS.",1602018608,1602032899,True,0,0,0,0,True,False,False,76561198307321340,61,19,706,37,706,1601704214
12,77149668,english,Its a good game.,1602024642,1602024642,True,0,0,0,0,True,False,False,76561198157406700,46,8,1101,505,1101,1601851042
13,77148962,english,"Do you want to under the phrase 'War is Hell?'

Are you ok being a statistic?

Are you John Rambo?
",1602023279,1602023279,True,0,0,0,0,True,False,False,76561198165757421,44,1,6108,237,6025,1602029456
14,77148700,english,"Like every other Tripwire game , rising storm vietnam had alot of potensial, the game was unique set in mid 60s to early 70s
and you fight in famous battles in either north vietnam side or the south
but devs just left the game in a very bad state, it has alot of problems like massive fps drops,bugs, and alot of cheaters and glitch users.
it couldve been one of the most unique fps game out in the market but these days even servers try to hack your account when you wanna join
avoid this game for your own safety there is nothing else left to have fun with in rising storm vietnam.RIP",1602022772,1602022772,False,2,0,0.513274312019348145,0,True,False,False,76561198142255799,123,15,20997,0,20997,1597405564
15,77145602,english,i was only 19 :(,1602017713,1602017713,True,0,0,0,0,True,False,False,76561198181144482,39,10,4452,805,4283,1602042164
16,77138351,english,funn,1602007351,1602007351,True,0,0,0,0,True,False,False,76561199081587221,4,2,690,97,641,1602010305
17,60778126,english,"get shot
repeat
fun",1577563224,1602004388,True,0,0,0,0,True,False,False,76561198111318775,125,38,2631,0,2631,1597020599
18,70963537,english,BROKEN ARROW BROKEN ARROW,1592451839,1602002519,True,0,0,0,0,True,False,False,76561198388686850,62,2,7013,0,7013,1599884611
19,32154046,english,"BETA game its far from done!!! devs are just to lazy! 

Its the game where the M16 has a higher caliber than the AK-47.

Its the most buggy FPS shooter ive ever played. ... it still has ALL the bugs and animations from RO2 its just all reskinned, and they freakin REMOVED the COVER system?? !!!!  they added choppers (choppers are awesome though) 
RO2 is in my opinion still 10 times better it has more maps and the spawns in that game are much better, in this game you often get spawnkilled in your main spawn it makes a lot of matches unplayable.
the gameplay in general is alright it still has the awesome mechanic from RO2 but they are lazy and don't fix the BUGS and GLITCHES from RO2.
the tunnels are mostly not even placed!! because a lot of people think its Shitfield 1 or something??  the ARTY in this game is to buggy when youre in a house or tunnel you will mostly get killed by ARTY/Napalm/Gunship, the creators did a really bad job on this title. 
in my opinion its one of the worst FPS shooter to date.

The new FLC is quite good!! love the maps and the guns just that the main weapon for the Australian army is bad real bad (L1A1) you have more chance with killing someone with the bayonet than shooting the thing. 

SO DO NOT GET THIS GAME!! (im going back after every update to see if they made progress) they did with the general gameplay the Vietnamese in my experience win more (like they should) they are still loads of bugs. they have updated the m14 and its now actually usefull. but with the AK you still have to shoot over 10 bullets to kill someone. 
Its clear to me that the devs have the worst map desingers, you can clearly see that after the last major update. The maps are just sooo poorly designed no flanking just linear gameplay with death zones for the attackers like the map A Sau (ASS) 

The hit Registration is the worst ive seen in a long time, you often unload your whole mag into someone and still no bullet hit. What i also have noticed lately that some bullets can Pen anything, ive been killed multiple times inside a tunnel from over a 100 metres. 

For some reason the Flamer is debuffed? i have used it an entire match and it has become useless at short range,fire does less damage now apparently.

The maps are really badly designed, the main spawns are often way to open. So when there are choppers in the match youve lost pretty much. 

As of June 1st 2019, they have added a lot of new maps, creator/player ones. Which are the worst ive ever seen in any video game, the vanilla ones are even better. The guns seem to deal, barely no damage just like the grenades they are pretty much useless. The spawns are even worse on the newer maps. 

Only good thing i can say about this game is that the updates are all free, you don't see that anymore.


this game is just a reskinned version of Red Orchestra 2.

If you still want this trash, get in the sale when its around 7 EU.

As of August 24 2019 nothing much has changed, most server now run the Custom maps which most of them are really bad, Battlefield kind of bad.

As of January 13th 2020: Its still a terrible game, all the stuff mentioned above are still there. They did add the feature that you can basecamp the attackers/defenders. That  has completely destroyed all of this game.",1496500843,1601997877,False,0,0,0,0,True,False,False,76561198108467087,149,41,22738,330,22738,1601997713
20,32066827,english,"Rising Storm 2: Vietnam

This game sucks but put on a Veitnam war soundtrack and it a 10/10 masterpiece

I tell ya.",1496164354,1601996844,True,4,1,0.566929101943969727,1,True,False,False,76561198120222781,264,14,569,0,569,1517765652
21,77126261,english,It's free on epic games on 8th october 2020...check it out guys,1601990862,1601990862,True,3,0,0.566929101943969727,0,True,False,False,76561199032017109,5,4,52,52,52,1601567169
22,77125905,english,murcia sux,1601990322,1601990322,True,0,0,0,0,True,False,False,76561198329734987,71,28,20,0,20,1593146429
23,77124995,english,"Great game,Really fun with friends",1601988897,1601988897,True,0,0,0,0,True,False,False,76561198133795905,230,6,2700,267,2432,1602073398
24,77109016,english,"Love the game, but man it can be stressful to play",1601955810,1601955810,True,0,0,0,0,True,False,False,76561198421083637,19,1,2478,1384,2341,1602032258
25,77104467,english,Its chill but its super laggy and wack,1601946561,1601946561,True,0,0,0,0,True,False,False,76561198189580046,40,12,790,132,789,1602004731
26,77094288,english,"I bought the game two weeks ago and now I found out its coming out on Epic Games for free and I cant refund it. but its a good game, waste of money though",1601927700,1601927700,True,1,0,0.523809552192687988,0,True,False,False,76561198967474330,16,9,253,0,253,1600729617
27,59750410,english,you run slow the mechanics all slow and stupid you die more then anything trying to aim or crouch the shooting makes 0 sence you cant get over any fucking obstacle you cant take cover anywhere its just another running simulator and die game im so sick of these pos fps games ALL OF THEM DONT BUY THIS unless u like vietnam n bad gaming mechanics XD,1576217231,1601924521,False,0,0,0,0,True,False,False,76561198067229429,124,9,6659,209,6659,1601924399
28,77085594,english,"""I gotta find bubba""",1601915471,1601915471,True,1,1,0.525862038135528564,0,True,False,False,76561198098998386,72,12,12996,675,12865,1601980951
29,77080060,english,A nice mix of realistic combat without it becoming tedious,1601908016,1601908016,True,0,0,0,0,True,False,False,76561198422451479,81,3,1852,100,1751,1601915472
30,77073970,english,"I got to play the beta for this game way back in 2017, and I've since logged over 300 hours of playtime. While you should know that the game is more or less done with content, the stuff that's in the game is very fantastic. While there are some bugs here and there, there's nothing I can recall that's game breaking, rather more annoying than anything else. Community is, well, it's a Red Orchestra game, so expect the drudges of human society to show up. Overall, I'd say this game is an 8/10.

However, one thing I should note is that mod support is a little scuffed at the moment; essentially, servers cannot run stuff like the Winter War mod and the Gameplay Overhaul Mutator, without the server being unranked. So don't go into this expecting to play mods, at least for now.",1601899133,1601899133,True,1,0,0.514285683631896973,0,True,False,False,76561198056605655,211,10,22296,1517,22061,1602089658
31,77067758,english,"""Anti-Ass defenses are active!""",1601887226,1601887226,True,0,1,0,0,True,False,False,76561198063394916,79,16,12587,1006,12320,1602070405
32,76594767,english,"Bugged server menu (spamms connecting to random servers and can't stop it), bugged weapons (can't aim down sight or shoot, dshk disappearing when you die), bugged movement ( jumping over an object and going back, or lagging after you go prone), the game is not worth 20 euros nor are the people behind it. Can't deliver a product in conditions.",1601124349,1601875855,False,0,0,0,0,True,False,False,76561198394502123,8,3,78903,1678,78828,1601966756
33,76367836,english,"Bugs, bugs, BUGS. Janky as all fuck, for god knows how many years this has been out. Your character will get caught on the terrain, randomly lower their weapon, or get stuck and vibrate on the spot - going prone is especially bad for this, it's like playing the lottery. Select a grenade, wait no it didn't work, try again, nope, try again, ok now it's out, now I'm dead. Or better yet, throw it, but don't actually throw it, only to throw it at your feet/a wall/your teammates. Devs would rather release cosmetic DLC than un-fuck the game, and now have just abandoned. 

Many of the maps are just bad but will be picked over and over again *cough Resort and Cu-Chi cough* by the braindead community. The winning condition is convoluted as fuck - you'll be playing a game where you're ok for time, doing well on objectives, then suddenly run out of tickets, with the enemy team still having well over a hundred. Or you'll have tickets but run out of time. Or get locked out of capture point, which is on yet another timer. Moreover, playing on the objective isn't nearly incentivized enough, resulting in people going off into the bush to look for kills, then acting surprised when they lose all the points.

Community is terrible too, if you happen to be one of the actually fun roles to play, like pilot or sniper, you'll invariably get kicked because someone else wants to play that role. To add insult to injury, you can't even rejoin the same server for a while, you'll get a connection time out error. Only on League of Legends have I played with bigger shitheads.",1600760788,1601872463,False,0,0,0,0,True,False,False,76561197986316638,213,13,3701,642,3664,1601880499
34,39167019,english,"I've been meaning to change this for awhile

Problems I came across --
 
- Sliders in the class load out screen are sometimes clunky
- Resolution could be improved
- ""Invalid Packet"" Error

What I would like to see --

- More vehicles
- If possible, Fully destructible environments


Otherwise, Great game, Great community. It reminds me of BFBC2V.",1515366529,1601862993,True,0,0,0,0,True,False,False,76561198202982945,15,1,21983,1527,21831,1601949215
35,77052261,english,"Honestly, do not recommend. 
I've put a lot of time into the game and was I really enjoying this game? or missing RO2? I have to say it seems more of the latter. This game is filled to the brim with some of the most annoying issues and the Devs just abandoned it. Having to reload twice to be able to shoot again, having to throw the same grenade twice just to get it off once, RPGs used as anti infantry instead of anti helicopter, bipods in general, how all the maps boil down to being trees and bushes as the best cover because of RPGs. They promised land vehicles but none came. I would not recommend buying it at this time, the only thing I really enjoy about this game is the game mode campaign, and that more so because of RO2 than anything to do with this game.",1601855521,1601855521,False,1,0,0.476190477609634399,0,True,False,False,76561198034118845,462,6,17842,1739,17814,1601855857
36,67725795,english,I GOT BANNED FROM MY FAVORITE SERVER FROM SALTY ADMINS LOL NO OFFICIAL SERVERS FUCK THIS GAME,1587427172,1601854964,False,0,0,0,0,True,False,False,76561198088261628,140,73,8545,1079,8441,1602046676
37,77048971,english,Racist so its pretty good,1601849511,1601849511,True,0,0,0.476190477609634399,0,True,False,False,76561198139269347,147,7,1898,1768,1184,1602085154
38,77044804,english,"Go home G.I, play Rising Storm 2 Vietnam.",1601842842,1601842842,True,0,0,0,0,True,False,False,76561198353146916,129,15,4161,1112,4087,1601937526
39,77041448,english,Good to be back home :),1601838234,1601838234,True,0,0,0,0,True,False,False,76561198133825751,58,6,403,399,217,1602090943
40,77041199,english,"Some folks are born, made to wave the flag
Ooh, they're red, white and blue
And when the band plays ""Hail to the Chief""
Ooh, they point the cannon at you, Lord
It ain't me
It ain't me
I ain't no senator's son, son
It ain't me
It ain't me
I ain't no fortunate one, no
Some folks are born, silver spoon in hand
Lord, don't they help themselves, y'all
But when the taxman comes to the door
Lord, the house looks like a rummage sale, yeah
It ain't me
It ain't me
I ain't no millionaire's son, no, no
It ain't me
It ain't me
I ain't no fortunate one, no
Yeah, yeah
Some folks inherit star spangled eyes
Ooh, they send you down to war, Lord
And when you ask 'em, ""How much should we give?""
Ooh, they only answer ""More! More! More!"", Y'all
It ain't me
It ain't me
I ain't no military son, son
It ain't me
It ain't me
I ain't no fortunate one, one
It ain't me
It ain't me
I ain't no fortunate one, no, no, no
It ain't me
It ain't me
I ain't no fortunate son, no, no, no",1601837862,1601837862,True,1,2,0.523809552192687988,0,True,False,False,76561198073247078,78,11,2246,688,2082,1602033628
41,77038350,english,DEFEND THE RICE FIELDS WITH YOUR LIFE!!!!!,1601834232,1601834232,True,0,0,0,0,True,False,False,76561199070917669,9,4,1143,428,1112,1601836116
42,77035189,english,"What a shame !!

The game is pretty good, the concept is decent, a solid tactical shooter squad based game with a commander role with abilities, i cant say any bad things about the game except the outdated graphics and need for some optimization which clearly by now more than 3 years the developers abandoned the game, other than that the game is good.

HOWEVER; the player base is just ruining the game, most of the players are acting like call of duty players in a tactical game; rushing the map jumping like crazies and have 0 communication or commitment for team play and to squad leaders commands, which the game was created for !! 

Also i need to mention the roles being picked by player due to their computer power and connection speed to be faster in loading the map, so good luck getting any good class.

Reference to all that, unfortunately i cant recommend this good game due to its player base.",1601830359,1601830359,False,2,0,0.490125983953475952,0,True,False,False,76561197990887564,189,3,339,70,339,1601826321
43,76623424,english,this game is trash i got to play it for two weeks then out of know were i cant find any servers and the starting screen has fucked up version of a us marine that fucking blue and purple,1601158439,1601829528,False,0,0,0,0,True,False,False,76561199079471688,4,1,2325,872,2324,1601845252
44,77033535,english,Go Home GI,1601828243,1601828243,True,0,0,0,0,True,False,False,76561198798264966,60,7,2558,499,2494,1601848121
45,77024877,english,"vietcong soldiers voicer : ""chúng ta sẽ đánh đuổi đế quốc nga ra khỏi mảnh đất của chúng ta"" its mean ""we will drive the Russian empire out of our land"" and excuse me WTF is that ?",1601817632,1601818382,False,0,1,0,0,True,False,False,76561198390344543,14,1,2909,125,2909,1601371855
46,77016188,english,no i wont describe what i liked or disliked about this product.,1601804997,1601804997,True,0,2,0,0,True,False,False,76561198347665430,68,2,1976,742,1672,1601919280
47,77011230,english,Pretty fun but some of community takes it way too serious,1601796945,1601796945,True,0,0,0.476190477609634399,0,True,False,False,76561198346918298,28,1,806,806,192,1602042802
48,77006931,english,I really enjoy this game. its pretty fun,1601789123,1601789123,True,0,0,0,0,True,False,False,76561199070171339,13,4,848,26,848,1601789067
49,77006886,english,good,1601789020,1601789020,True,0,0,0,0,True,False,False,76561198106965881,60,3,1421,293,1127,1601960547
50,77006252,english,good game,1601787773,1601787773,True,0,0,0,0,True,False,False,76561198078895729,102,4,5155,33,5155,1601785182
51,46518254,english,M60 go brrrr,1542952203,1601784980,True,1,0,0,0,True,False,False,76561198304153203,12,2,72316,2673,71839,1602090607
52,77003921,english,has Owen Gun so good game,1601783468,1601783468,True,2,0,0.526315808296203613,0,True,False,False,76561198531193221,83,28,675,0,675,1559301739
53,77003878,english,Pog,1601783377,1601783377,True,0,0,0,0,True,False,False,76561198944783367,15,3,2188,164,2057,1601944673
54,77002338,english,"Is a good ol' time until you watch Billy burn alive in a poorly dropped Napalm.
",1601780756,1601780756,True,0,0,0,0,True,False,False,76561198262457283,73,16,4172,1332,2840,1602089495
55,76998188,english,our homes are safe!!!!!,1601773173,1601773173,True,0,0,0,0,True,False,False,76561198104813057,58,10,5537,370,5404,1601781118
56,76996887,english,go home g.i.,1601770723,1601770723,True,1,0,0.523809552192687988,0,True,False,False,76561198093949456,110,6,2160,2127,955,1602044115
57,76996616,english,fun,1601770240,1601770240,True,0,0,0,0,True,False,False,76561198171465785,25,1,1111,404,999,1601863460
58,76995823,english,the game will be free on epic games from Oct 08 to Oct15 get it you wont regret it,1601768868,1601768868,True,1,0,0.523809552192687988,0,True,False,False,76561198051001028,46,7,8142,296,8142,1601399349
59,76990300,english,Very nice yes yes,1601759924,1601759924,True,0,0,0,0,True,False,False,76561198987987723,9,1,1418,1418,688,1602016316
60,76988329,english,"can be quite a fun game but gets quite boring quickly, if you dont mind enjoying the fun while it lasts then go ahead spend your money on it. However the community can be quite toxic (the people u will be playing with) and with most RO games newbies arent really welcome in or players that want to improve on certain roles such as pilots.",1601757151,1601757151,False,0,0,0,0,True,False,False,76561198123768987,63,7,18340,240,18340,1601757039
61,76987140,english,"The game allows friendly fire and does not designate who is an enemy.

And since everyone can customize their toon, it makes it EXTREMELY hard to tell who you are shooting at.

The game has a lot of very promising ideas, but its just too frustrating to figure out who you are supposed to be shooting at.",1601755528,1601755528,False,1,0,0.418250977993011475,0,True,False,False,76561198030961604,108,14,68,52,68,1601609495
62,76978428,english,"""Welcome to Estalia gentlemen. I will not lie, the chances of your survival are small. Some may even turn against your friends as living corpses, but you have my word that I will use my arcane gifts to ensure your bodies are given unto Morr's Garden. This is the greatest reward, more than even gold, for the fate of your soul is an eternal concern. Now come, follow me. Strike down the undead that rise against us, allow me to find this eldritch amulet. I ask not for my own selfish studies, but for the good of the Empire.""",1601744339,1601744339,True,0,0,0,0,True,False,False,76561198029692311,65,22,3096,0,3096,1586829473
63,76974540,english,literally the worst gaming experience I've had since dad told me grandpa died in the middle of black ops zombies match,1601739530,1601739530,True,0,1,0,0,True,False,False,76561198027764897,271,16,2357,288,2357,1601739421
64,61165663,english,Vibes,1577997105,1601728686,True,3,0,0.548153519630432129,0,True,False,False,76561198137227489,49,26,6361,93,6361,1601054557
65,76964442,english,One of the Best Games I've ever played. I just love it a lot and recommend it to anyone who wants to try out a new shooter,1601726731,1601726731,True,0,0,0,0,True,False,False,76561198069397464,385,16,8875,39,8875,1601073533
66,76952139,english,"amazing hyper realistic shooter, great community (depending on country) and awesome gameplay, if you like realistic fps games you will like this",1601707271,1601707271,True,0,0,0,0,True,False,False,76561198377055999,5,2,2948,248,2934,1601885583
67,76951523,english,"haha BARAJ IMBOUD TAIK COBER

haha YUUUUUUUUUUUUUUUUH

haha tamali this is charlie foxtrot whatever the hell we're called and we're requesting one of your fast movers

haha SOMEBODY KILL THAT ASSHOLE

haha the enemy is running out of time",1601706081,1601706081,True,2,1,0.525395512580871582,0,True,False,False,76561198190678785,125,20,4404,161,4404,1601496822
68,76951235,english,"This is a very good game, highly recommend. Gonna get 200 hours in this like Insurgency I hope.",1601705510,1601705510,True,0,0,0,0,True,False,False,76561198120684348,110,54,905,819,776,1601760276
69,76950999,english,Best multiplayer war game I've ever played,1601705092,1601705092,True,0,0,0,0,True,False,False,76561198168778604,43,1,5392,608,5323,1601790992
70,76949738,english,i love being commander slave,1601702794,1601702794,True,0,0,0,0,True,False,False,76561198394552305,43,4,1918,1016,1738,1602075091
71,76947189,english,Very fun game if you love the Vietnam War. The screams of injured solders is a little disturbing to listen too though.,1601698043,1601698043,True,0,0,0,0,True,False,False,76561199033648686,12,8,1169,1096,1134,1601700035
72,76947070,english,"rising storm vietnam 2 is one of those games where time is irrelevant because I swear 2 hours in this game happens in 3 minutes, outstanding and competitive game",1601697810,1601697810,True,0,0,0,0,True,False,False,76561198815570655,44,20,1748,0,1748,1597906673
73,76940809,english,"You will not like this game if you are not decent at FPS Games, This is a brutally ""Realistic"" historical shooter that rewards team gameplay heavily, Select roles, lots of authentic weapons and the best part of all, Make your own Vietnam era soldier, South or North. gunplay feels great and the game is way less buggy than the previous, can reccomend 100%",1601686688,1601686688,True,0,0,0,0,True,False,False,76561198210894876,69,16,2342,714,1993,1602051994
74,76940186,english,"very action packed and fun, its a shame more people don't know about this game. If your'e into COD I'd definitely give it a shot!",1601685531,1601685531,True,0,0,0,0,True,False,False,76561199085189514,2,1,4891,1608,4479,1601958940
