,recommendationid,language,review,timestamp_created,timestamp_updated,voted_up,votes_up,votes_funny,weighted_vote_score,comment_count,steam_purchase,received_for_free,written_during_early_access,author.steamid,author.num_games_owned,author.num_reviews,author.playtime_forever,author.playtime_last_two_weeks,author.playtime_at_review,author.last_played,timestamp_dev_responded,developer_response
23,49105761,english,"I really like this game, I have had it only a few weeks and have 129 hours of gameplay. I understand this is still early access and look forward to more additions and updates. There are different gameplay modes, I have only played life cycle mode. The only complaint i can have at this point is about KOSers, maybe if dinos did less damage and had more defense when full of food , this could be curbed a bit. So many times i have been killed and my meat left to rot. I don't see why players would complain about this when there is a game mode that is aimed at just fighting other dinos.",1550599449,1550599449,True,0,0,0,0,True,False,True,76561198056617230,29,2,7736,0,6889,1558310270,,
24,49091999,english,"I want to love this game, but the constant bugs you run into kills it for me. I spent a day and half growing a petra just for it to bug out on me...they have an unjam button which is great but all it did was make me fall to my death without allowing me to pull up or move at all.  It has  great mechanics just needs some work and i am sure it will get there.

I will probably change this review in the future but as of now id wait on this game.",1550535065,1550535065,False,2,1,0.494252860546112061,0,True,False,True,76561198076391501,173,9,32962,0,5554,1599966942,,
25,49078607,english,"Great Game
Has still some issues. But in the few days that I played it, the developers have adressed the most important ones (like server crashes). The gameplay is great & especially the community is amazing. 
Either put it on a wishlist and wait for it to be freshened out a bit, or just buy it and have fun already. 
The mixed reviews are because there is a beef war between this game and The Isle, so people leave negative reviews so the other is more popular, & because it is still relative early in development, which comes with the problems that such games have. But it feels like the development is accelerating",1550518728,1550518728,True,0,0,0,0,True,False,True,76561198027389893,233,13,10100,0,1441,1597434866,,
26,49068593,english,i'll love to see the that diging dino :),1550477483,1550477483,True,3,1,0.497945636510848999,0,True,False,True,76561198072049152,17,8,9179,0,3474,1597107830,,
27,49041574,english,"Pros:
Customization is very cool. 
Talent trees are neat and give you something to look forwards to when you die and start over. 
Balancing the talent tree points and your food consumption rate against your total growth size is a neat way to soft-cap how big you can get.

Cons:
Lag is pretty bad while fighting sometimes and servers are crashing pretty regularly after 2-3 hours.
Group comfort bonuses are a tad on the strong side. 
Unofficial servers don't have a lot of rules, while unofficials might have ""weird rules"".
Glitches can and will kill you. People will break rules and kill you on unofficials when they shouldn't (not everyone reads the rules, most servers keep theirs on discord).
Graphics are stylized instead of realistic...? (I personally like it.)
",1550362203,1550362203,True,0,0,0,0,True,False,True,76561197994169747,285,7,87164,780,6912,1601914821,,
28,49037931,english,This game is amazing and has a lot of potential when I first got it I loved it. It was something fresh and away from the isle. It has better game mechanics and flying and water dinos. Overall it's a great game the community is pretty good for the most part you do get the one toxic person from time to time but overall it's good. Now what killed this game for me was the fact that all offical servers have no rules and that is good and all for some people but I'm my case not so much. With these no rule servers that almost everyone plays on it allows for mass kos from dinos that are 10 times your size and will kill you just cause they want to even if they have food. I have run into plenty of bugs and the devs seem to be working hard to fix them and yes this an early access game and yes it is a lot of fun but the no rule official servers and the fact that all servers with rules have no players just kind of killed my drive to play. So i would say if you want something fresh from the isle give this game a try just be ready for bugs and be ready to die a lot to kos Rex's and the occasional bug,1550347899,1550349018,True,0,0,0.476190477609634399,0,True,False,True,76561198141578749,107,3,26228,148,14397,1601240813,,
29,47888816,english,"Reminder : This Review will be Updated with more Details soon. 


You can be a Birb and its working fine not like in an specific other game

[ Engine : Unreal Engine 4 ]

- Performance : Needs some Attention (Better CPU & GPU Usage)
- Latency : Needs some Attention (Some players just Teleport or have lags/ruberbanding)
- Bugs : couple of
- Models : They are OK but an Overhaul/Update would not be wrong  (This Means Map & Dinosaurs)
- Foliage & Map : Needs to get a bit Updated some places have Invisible Water, Trees & Stuff. Some Terrain is to Sharp so you also stuck on that (abit more Using of the Smooth Tool) 
- Admins & Mods : Always Online on Official Servers, answering Questions and Take Feedback & Bug Reports aswell 
- Features : For being out Roughly 10 Days and having this kind of Features is a good start, hopefully Devs will not Stick on it and keep it only this way


If you thinking about Buying it, do it its worth it.",1545983671,1550226484,True,0,0,0,0,True,False,True,76561198176359535,210,22,5568,0,5368,1551601306,,
30,48998644,english,"I don't usually comment, but this over time will dominate The Isle. Im not trying to compare. It just seems to be the battle between two great games. This has clearly focused on dinosaur models, while the isle focuses on enviroment. I would like to see burrowing dinosaurs done, because i really want to play as them. I would also like for Beasts Of Bermuda to pay a little more attention to the animations, as my eating animation on lurdu seems slightly bugged. recommend this game in many different ways.",1550199520,1550199520,True,1,2,0.490836650133132935,0,True,False,True,76561198340959863,57,12,780,0,113,1553233197,,
31,48981132,english,I died as a fresh spawn apato and didn’t cry for 30 minutes like everyone else does. Also it’s early access they shouldn’t have reviews yet because this isn’t even the final product,1550121166,1550121166,True,1,0,0.508928596973419189,0,True,False,True,76561198398805347,35,4,31644,767,5011,1601696983,,
32,48954520,english,"See the Early Access tag? Indie developers tag? Okay even if you didnt, now you know. This game hooked me immediately and I've quickly become a supporter for it to succeed. The dev's are very active in their community discord. They work hard to fix bugs that are found and game breaking balancing issues. Since I started playing there has been one or more patches per week for fixes (remember early access). At the same time as the bug fixes there are also separate people working on new map/map overhauls as well as new content. Performance issues may happen at times (again early access) and (currently)  with 40+ players on a server you can see and feel the teleporting lag (mostly during combat) however performance fixes are in almost every patch. Crashes happen at times but 9/10 of those only ~2.5 minutes of progress is lost. Now if you're looking for a complete game with no bugs etc I'll tell you now don't try this out just to give it a bad review. YET. Wait until it's out of EA. But if you can handle a few hiccups until it gets polished it deserves a chance. And even though the tag isnt on here it is a survival game. Be prepared to die. Respawn or nest in and try again. Try different species, tactics, maps, game modes, servers. This game has potential and the dev's are very dedicated. I for one will be around to see where it goes from here.",1549998066,1549998066,True,1,0,0.486312389373779297,0,True,False,True,76561198084681296,128,5,19851,0,8895,1584821406,,
33,48893838,english,this feels like a cell phone game,1549785060,1549785060,False,5,5,0.514343321323394775,0,True,False,True,76561197995940226,443,13,41,0,41,1549784662,,
34,48893830,english,"I was told this was better than the Isle, I am not sure that is true.",1549785038,1549785038,False,11,5,0.508257210254669189,0,True,False,True,76561197977794090,321,14,48,0,48,1549784896,,
35,48785712,english,"It's just nowhere near where The Isle currently is, in terms of gameplay polish, graphics and immersion.
When your dino cant even walk properly without stiff animations that dont blend, and the textures looks like something out of a Pixar movie, i just cannot reccomend this as your dino immersion experience.
If you just want an arcadey game with dinos, sure. But once you've played The Isle, you cannot stand the arcade animations and models in this game, sorry. I've been spoiled.",1549405223,1549405223,False,6,1,0.494574546813964844,0,True,False,True,76561197985171381,254,26,34,0,34,1546356136,,
36,48720841,english,it keep crashing before it even load into the menue screen,1549144360,1549144360,False,1,0,0.477251023054122925,0,True,False,True,76561198406160647,12,2,33,0,33,1549149036,,
37,48696170,english,Fun to play by yourself. Better with friends.,1549048736,1549048736,True,2,0,0.493452340364456177,0,True,False,True,76561198039329460,259,188,2177,0,1312,1557543220,,
38,48655424,english,"so i grew with my cousin to full grow Mega with 1.2 which took 8 hours we kill a apata{long neck} fair and square to which a stupid admin pops up saying accidenlty was stomped by teamate but wait for this the apata we killed gets full growth back to which i gets banned off the server for simply saying why does get his stuff back we killed him...
devs if you remove someone called : [TG] langafi Stoin  
then i might just give you a good review other than that shocking game do not buy my fun was ruined.",1548889687,1548889687,False,6,6,0.347000479698181152,7,True,False,True,76561198304347467,79,5,1761,0,1298,1577631875,,
39,48655287,english,Shitty servers with shitty admins... When you kill an admin they rez them self and kill you... GG WP,1548889120,1548889120,False,12,1,0.505081117153167725,0,True,False,True,76561198016589184,783,46,1574,0,1107,1577631875,,
40,48621704,english,pretty bad,1548742015,1548742015,False,10,1,0.511422514915466309,0,True,False,True,76561198375426616,66,1,1109,88,11,1601721804,,
41,48599440,english,"Bob is essentially the better version of The Isle. In-game mechanics, Marine and Avian dinosaurs, An upgrade system. The Isle should have had these additions years ago, the only reason development has picked up on The Isle is because the devs are afraid Bob will beat them out. Rightly so. Bob has so much to offer not even being out for 3 months. The bugs are a downside but, having creatures that you can customize with colors and talents allows for better personalization and control. Buy Bob if you want a colorful dinosaur simulator that has more to offer than a multitude of characters and boring gameplay.",1548633855,1548633855,True,3,2,0.499537467956542969,0,True,False,True,76561198163464707,71,14,44761,0,7335,1599972479,,
42,48598036,english,Its fun. Its a dinosaur survival game with a skill tree. its fun. thats all i really have to say about it.,1548627133,1548627133,True,0,0,0,0,True,False,True,76561198182128207,106,20,5851,0,1194,1597184368,,
43,48594306,english,"Great game. Lots of very unique game mechanics, very common updates, and developers who CARE. There are plenty of bugs now, but they're constantly being ironed out while new content is still streaming through. You can compare it to The Isle which obviously has better graphics, but Beasts of Bermuda already simply has more to do and, in my humble opinion, is just more fun. And on top of that all, it has potential. So so much potential, and the way it's going now it appears to be heading towards that beautiful potential, at full speed!",1548613707,1548613707,True,0,0,0,0,True,False,True,76561198136621726,48,4,10561,0,7605,1577046903,,
44,48576715,english,Amazing i love this game! Beautiful graphics  and animations hoping skins for velo and utah will come out soon!,1548545928,1548545928,True,0,0,0.499451577663421631,0,True,False,True,76561198139204230,7,3,62844,1123,5035,1601586683,,
45,48571942,english,"This game deserve to prosper. It has loads of potential. The dev are obviously working on it.

Here's a Tip. Its a survival game. If you don't like to die. Buy Mario Kart.
If you can enjoy your success at outsmarting Darwin. Buy it.",1548529592,1548529592,True,6,1,0.55086970329284668,0,True,False,True,76561197988951685,98,2,49372,0,5671,1599083368,,
46,48167416,english,"Although the game is very buggy and unplayable at times, it has great potential. I highly suggest buying it if you are into these kinds of games, because Beasts of Bermuda is probably the best of its kind at the moment. The game has features that no other dinosaur simulator has ever had, dare I even say that it is revolutionary in the genre! Character customization the likes of which have never been seen before, unique abilities and great variety among the playable characters, nesting, A SKILL TREE... All of these features make the game truly unique and exciting.
The game is already quite good as it is, in my opinion, but it does lack in some areas. It is extremely buggy and laggy, as I have said before. There are some balance issues that are already being worked on. The graphics aren't all that good, but to me the visual aspect of the game doesn't mean much. What would definitely improve the overall experience, however, is better dinosaur animations and models. For me, most of the dinos feel a little robotic, a bit too unnatural, especially the Ichthyovenator, whom I've been planning on maining the moment I bought the game.
Either way, I am excited for what the game has to offer in the future. All I can say for now is that the game had good start.",1546863015,1548497216,True,26,3,0.737862050533294678,0,True,False,True,76561198101717403,134,6,2987,0,1676,1593521713,,
47,48527610,english,"I've enjoyed the game so far and am looking forward to the game devloping and more content being added in the near future. 

I've found the graphics to be fine (or at least acceptable for an early access game) and the community to be very helpful for new starters, even on official servers. 

The perk system is a really nice mechanic that allows you to really build yourself to your playstyle, with three main arms - Combat, Survival and Speed/Utility, you gain perk points as you grow and you only stop growing when you are dead (though you will have increasingly diminishing returns as you grow past full size).

Obviously it is early access so rough around the edges as the devs focus on content / balance over optimisation and I am greatly looking foward to the new dinos to be added to the game (have a look at the suggestions sticky on the community hub for the list of confirmed dinos).

Aquatic life is quite brutal at the moment (though immensely satisfying when you catch a swimming / drinking terrestial dino) and this looks like it is going to be addressed in the near future with the release of playable, fully aquatic, herbivores.",1548355503,1548355503,True,2,0,0.501018285751342773,0,True,False,True,76561198055494684,242,19,1781,0,1689,1548611788,,
48,48511843,english,"It's like a certain other game with actual gameplay mechanics. If you like the only other multiplayer dino game than you will probably love this.

It's EA of course. It's not polished, it still has loads of bugs (including some frustrating ones) and it's not as pretty. But give it time, patches come out fairly regularly.",1548277574,1548277574,True,2,0,0.501018285751342773,0,True,False,True,76561198038941424,186,5,24307,0,6612,1600076356,,
49,48502079,english,"Experienced Isle & Bermuda player weighing in..

Yes, Isle has better graphics but the advantage ends there.
Bermuda > Isle in every way besides graphics 

Also BoB is ran on Unreal engine it has good graphics (turn ur graphics settings up bro)
The Isle is still a GREAT game and you should still play it (i have nearly 1,000 hours played on isle) 

Don't want to die on the Isle? Growing never stops on BoB, you'll want to live more than you did on Isle
Somewhat bored of land? Be a Pteradon and fly around or be a giant fish and swim around

Swim into low tide get stuck in puddle then get killed by a T rex
Be a giant fish that can grab dinosaurs and pull them into underwater caves to be eaten

Underwater caves are everywhere on the map, explore and learn where they go.
Unlike The Isle semi aquatic dinosaurs actually swim faster in water (real suchomimus)

That should be enough examples to prove Beast of Bermuda is the better game.
Find a decent server with a few rules and high population. 

9/10 would get eaten by a shark again
",1548237247,1548237247,True,19,8,0.62534099817276001,0,True,False,True,76561198099046565,25,7,30497,453,16328,1602054740,,
50,48470497,english,"https://i.gyazo.com/97c39942980793604999f8a112213b87.jpg
https://sastreistudios.com/

This is what BoB does. Stealing content from others to ""improve"" their already shitty game.

BoB= Quantity >Quality

https://discord.gg/GzbBsQh - Go raid it.",1548117749,1548117806,False,1,0,0.323271661996841431,2,True,False,True,76561198836015035,53,10,2105,0,74,1576709554,1548449755.0,"First of all, what you see is YouTube recommendations. This website was using a YouTube video as background. It's different for every user. 
We are now updating this old website, which was made over a year ago, and wasn't touched since. 

Considering the aggressiveness of your review along with its defamatory nature, with it being false accusations, not to mention violating Steam's CG, it is now flagged."
51,48470377,english,"Absolute Trash. Barely runs even on the lowest settings, and the game already looks very ugly as is. I would rather play The Isle or fucking Roblox Dinosim over this garbage. Waste of 20 bucks, stay far away from this waste of money.",1548116943,1548116943,False,2,0,0.437665790319442749,0,True,False,True,76561198084141155,95,30,21,0,21,1548111493,,
52,48381495,english,"When i first bought it I really did have fun,but after about 8 hours the problems showed,I cant recomend it in its current state. As a solo player you will have a hard time growing due to large carnivors Killing On Sight whether they need food or not. If they pick up any bit of your scent its over as your scent leaves behind a cloud they can follow,they will chase you down and kill you.There are 2 maps and the most popular is small for a survival game with both water and meat being fairly scarce. Hit detection is also a problem for small dinos as enimies can rubberband around during the fight,and if this isnt a problem the fight will consist of you and your opponent walking in circles trying to bite eachother as turning is slow.You can also be hit through walls if the enemy dino is big enough.",1547725743,1548031750,False,13,2,0.649707317352294922,3,True,False,True,76561198057975115,168,1,2982,0,2611,1590296263,,
53,48445359,english,"lot's of potential, but unplayable for now, tons of bugs, glitches and rubberbanding.  keep an eye out on this one tho, i'm fairly sure it could grow into a good game.

the isle might be the better choise right now, but that game lacks real gameplay and made hardly any progression in 3 years.  check back later in a year or so, and this game has bypassed the isle.",1548002630,1548002775,False,2,0,0.500352859497070313,0,True,False,True,76561198028844228,191,20,1840,0,1143,1598049420,,
54,47689171,english,"Beasts of Bermuda is a massive dissapointment for me. I knew its similar to The Isle but I didn't expect it to be excatly like The Isle, thats the impression I got playing and watching some YouTube videos. I didn't mind the visuals going into it but sweet jesus it looks ugly to look at! It feels like those cheap indie games with badly executed animals...thats exactly what Beast is to be fair. The dinosaurs look decent at best but the quality of the dinosaurs besides the designs are lazy. The skin mechcanic could of been awesome but its too complex, it feels like too much time was put into the skins instead of really polishing the game up. The community is highly toxic because it seems to be full of KOSers and in general people being assholes to other people. I'd skip this and find something better.",1545427235,1547976448,False,5,1,0.471913248300552368,0,True,False,True,76561198072709796,20,7,53,0,53,1545426590,,
55,48412604,english,"Has great potential, still needs alot of work. This game offers some extra mechanics that the likes of The Isle doesn't have (yet), therefore is a refreshing alternative. Where it falls short is the graphics, animations and overall feel and immersion of the game. If devs built on these areas and brought them up to the standard of The Isle it would be a great contender.

Would recommend if you enjoyed The Isle, probably not as good but it's one to keep an eye on",1547869879,1547869879,True,8,1,0.594204723834991455,0,True,False,True,76561198045416608,74,4,2244,0,1137,1597742868,,
56,48409163,english,"Pretty buggy at the moment, crashes and most users have to play with pretty bad stuttering, even myself on a decent rig. I'd wait on it for now.",1547851028,1547851028,False,2,0,0.5,0,True,False,True,76561198046164607,53,15,138,0,111,1564358552,,
57,48110896,english,"After spending a little over 40 hours in this game i can genuinely say its not worth its money, if this game was free to play i might actually recommend it, but this game has a massive amount of balancing problems and poor design structures since it takes roughly 10hours to achieve anything of value and you can be killed in a matter of seconds by almost anything. While also having one of the most questionable communities in a game ive ever seen, and on top of that if you plan on playing this game by yourself, i recommend you have a bottle of bleach nearby because you're going to go nowhere very fast since the reliability of being spawn camped in this game is beyond ironically reliable. In survival games community can make or break a game, this games current community is extremely toxic and wouldn't recommend this game to anybody unless you wish to play in chernobyl.",1546655412,1547788586,False,0,0,0,0,True,False,True,76561198108905572,38,7,6723,0,2554,1572952425,,
58,48378823,english,"I can't believe people spent another $20 to leave the Isle and play this game instead.

Can't give an in depth review for this game since I had to refund it before my 2 hour mark, but after playing for less than an hour I quickly learned that:
-You die of starvation and dehyrdration in a matter of minutes.
-There is no grouping system for playing with friends.
-The game graphically looks like shit compared to The Isle.

This may develope into a better game some day, but if you want something playable and more enjoyable than this, buy The Isle.",1547711350,1547711350,False,5,2,0.373820006847381592,0,True,False,True,76561198165902694,90,7,613,0,58,1580171356,,
59,48376985,english,"I like this game, but
Cons: Unoptimized, unbalanced, extreme lag (teleporting, rubberbanding enemies) and Very slow gameplay
Pros: Very fun unique experience, sadly this is ruined by the above issues. 
Maybe this game will get finished maybe it won't as it stands. It can be pretty fun for the price but it's definitely not even close to done.",1547700152,1547700152,False,2,1,0,0,True,False,True,76561198049687473,102,22,6761,0,2757,1584698900,,
60,48376480,english,"I can not recommend this game to anyone. While the game is nice and still in beta, you can't get anywhere. People only either spawn kill, or gang. People are toxic as fuck, even refuse to be reasoned with. Even if you have a valid point, you get harassed. The game is good for what it is, but the community is trash. Admins don't do shit about except threaten to remove you all together. If any of you admins read this, ill keep making different reviews under different names if im banned. All i want is for you to fix your damn community, or my mother back, either or, don't care.
",1547697157,1547697157,False,4,2,0.5,0,True,False,True,76561198385438351,13,1,19142,0,3493,1592616636,,
61,48362772,english,"I don't even know where to start with this game. when i play this game, i get literally 5 frames, the graphics looking cartoony makes this game kinda sad. Some Bindings don't work, im starting to believe that Primal Carnage Extinction is more operational than this game",1547637562,1547637562,False,4,0,0.476190477609634399,0,True,False,True,76561198210800460,31,3,1374,0,33,1592219274,,
