,recommendationid,language,review,timestamp_created,timestamp_updated,voted_up,votes_up,votes_funny,weighted_vote_score,comment_count,steam_purchase,received_for_free,written_during_early_access,author.steamid,author.num_games_owned,author.num_reviews,author.playtime_forever,author.playtime_last_two_weeks,author.playtime_at_review,author.last_played,timestamp_dev_responded,developer_response
0,77186136,english,"Its not as realistic as the isle but its funny, great community on the right server and good game play, currently my fave game",1602087573,1602087573,True,0,0,0,0,True,False,True,76561198043958615,328,7,11081,6377,11051,1602089710,,
1,77181218,english,fucking sucks,1602081563,1602081563,False,0,0,0,0,True,False,True,76561198385903033,54,4,7316,122,7316,1602081321,,
2,76894328,english,"If it had better animations, more dinosaurs and better graphics/sounds and a less disgusting skin customisation system, I'd reccomend it for the current price, but atm no. I only find Aquatic gameplay to be the best, game still lacks a lot of fun aspects too it as you try to grow, needs more to do. Actual ai maybe lol. Earthquakes, Hurricanes, Tsunami's. Some stuff needs a buff without a doubt though -mosa-

[Needs some kinda anti-cannibalism factor for all species that encourages players to not eat their own kind and hunt for different species.",1601613451,1602066693,False,0,0,0.476190477609634399,0,True,False,True,76561198044527426,133,46,3167,3167,3167,1602066574,,
3,77158083,english,"It's fun. It's not finished and not as polished as some other games of its niche but there's lots of variety in the animals you can play and they have a fleshed out skill tree system that always gives you something to work toward. Makes a great alternative to The Isle or even Path of Titans. It may not look as pretty but it's an actual game, not a dinosaur walking simulator.",1602040759,1602040759,True,0,0,0,0,True,False,True,76561198813558330,24,1,9215,744,9215,1602040367,,
4,50481895,english,"Beast of Bermuda is a very colorful and neat play style in survival. The dinosaurs/ creatures you get to chose from is quite diverse. From flying in the area to swimming in dangers water with Mosa’s. Down to being the king of Dinosaurs- (Rex) it’s fun. 

Make your dinosaurs skin/ colors/ patterns. See your skills to help you survive better against other players and the weather. Fight, Nest and Protect Each Other Agenst All Odds. 

It’s only Multiplayer. - I do hope maybe a single player could be in the future but still a fun game. 

7/10- Controls

7/10- Graphic’s

8/10- Over All",1557007023,1602020650,True,3,0,0.548070013523101807,0,True,False,True,76561198943606907,250,6,94603,624,94382,1602036804,,
5,77140789,english,AMAZING GAME FOR JUMP SCARES AND JUST FOR FUN IN GENRAL.,1602010705,1602010705,True,0,0,0,0,True,False,True,76561199013711668,9,2,222,222,215,1602023725,,
6,77124055,english,"Awesome game , just wish we'd have a utah raptor and a spino maybe but overall pretty fun!",1601987377,1601987377,True,0,0,0,0,True,False,True,76561198101440877,63,5,5391,1969,5232,1602020263,,
7,50991086,english,"A lot of servers still suck so I find myself playing many servers rather than 1. A lot of servers have rampant admin abuse and many more are husks.

Either way, at least the mechanics and bugs are starting to iron out to the point that I can change my review. Given I had 9 before and well...i'm almost 700 lmao",1559388926,1601966531,True,0,0,0.497382223606109619,0,True,False,True,76561198062614140,63,32,39805,770,39575,1602030428,,
8,77087015,english,Chill game,1601917413,1601917413,True,0,0,0,0,True,False,True,76561198143799661,45,2,1943,1943,1086,1602033205,,
9,77075900,english,"I spent 38 minutes so far, only to adjusting settings and trying to make it work.
Only thing I managed to do without problems was run for a bit, like maybe 5mins trying to stand that. Other just game randomly freezing to title without being able to esc or anything. (Which I know is not my computer, as other games work smooth on epic graphics.)
And the motion blur is just awful. Didn't seem to find button to take it off? It is very laggy and broken, and I am disappointed. 
The buttons and whole layout looked like mobile game, search and other buttons not working at all.
People had cool reviews that made me very excited, but I think I am going for refund at this point. :/

Might come back once it seems to be more decent
",1601902137,1601902137,False,0,0,0.476190477609634399,0,True,False,True,76561198067641025,50,1,38,38,38,1601901799,,
10,77071069,english,"There's some argument that there are better dinosaur survival games out there, and while for other play styles probably yes. I for one think this is the best Dinosaur survival game on Steam so far. 

The graphics aren't called top notch, but I guarantee the features in this game and the constant attention from the developers is much better than having an over-glorified butt-munching battle with anything you cross paths with like observed in some other games I've seen. 

The devs fix minor things to massive things really fast and it's enjoyable. It's fun they add special skins and limited time shimmers. I enjoy the growth. I don't like having a stopping point because then I get less invested with my dinosaur. This game also implements skills and a genetic system to make growing more exciting.

There are players that are going to attack you and many of the LARGEST servers I've seen have super petty and toxic people online, people that will harass you because they attacked your child so you killed them kinda petty. BUT there are many decent servers out there and so you don't have to play with people that only want to harass you and your group because you didn't let them walk all over you.

There are many abilities for many dinosaurs. The Sai (Similar to the ankylosaur) can tuck in and deflect damage, turn in place to keep it's tail facing enemies and swing it's tail either direction. It's heavy so things can't swoop up and monch you as easily. Slow, but a decent dinosaur to grow. This is one example. Another good one is the Acro. It's able to roar at prey or enemies and deplete some of their stamina, it's strong and has a decent growth time. You can dig as the orycto and build a customized den. Tornados can't pluck up adult apas.

There's really so much this game has to offer and I wish I had more friends to play it with. I can't get it all in this one post, but I guarantee if you like this sort of game and want an active and DEDICATED dev team.... You'll like this one. Maybe even love. :)",1601894055,1601894055,True,1,0,0,0,True,False,True,76561198109613875,68,31,17938,63,17938,1601735241,,
11,77007720,english,Very cool game if u wanted the isle but u have a bad pc this is the game for u,1601790539,1601790539,True,0,0,0,0,True,False,True,76561199027033950,3,3,1922,1922,950,1602041824,,
12,76996445,english,"almost 4 hours and i LOVE this game, reminds me of the isle, less dinos but different dinos, if i could recommend this game to other people, i would but im a bit too lazy for that, but im not too lazy to get it and play, whoever is reading this, GET THE DAMN GAME, STOP WASTIN YO DAMN TIME",1601769934,1601769934,True,0,0,0,0,True,False,True,76561199030842362,26,9,1506,1506,230,1602090172,,
13,76981038,english,It's one more dinosaur game and has fun playable dinosaurs.,1601747607,1601747607,True,0,0,0,0,True,False,True,76561198386677052,26,8,2686,1104,1581,1602090919,,
14,76971272,english,"Short version:

If you like dinosaur games that have a lot to offer with regular updates, don't mind some bugs that might kill you and can handle toxic players and losing a dinosaur you spent a long time growing, you should give this game a chance. If you are unsure, wait some time and once the game updates more try then. It might seem bad but this game has come a long way here, I got this game soon after launch in steam and it's a lot better now in many ways. Hope you can support the game to grow even better.

Long version:

With the lack of a good balanced review with pros and cons I made this. At the end of the review I made some ideas on how to fix some of the problems.

Pros:
+Weather system: Drought (if it doesn't rain in a long time some water sources might dry up from drinking), tornados, rain, storms and floods will keep you moving.
+Special ability: Some dinosaurs have special abilities for example megalosaurus can see stats of other players and parasaurolophus can highlight enemy players to the rest of the herd to see.
+Skill tree: Want a fast rex or strong maybe, in between? take your pick.
+Nesting: You can get the baby buff to boost your growth if you are near your babies. If you hatch from an egg and have big parents you have a better chance to get good +inherits (+ points in skill tree).
+Lot of action: Be careful there might be rexes walking behind that hill.
+Customation: You can make your creature have the colors of the rainbow, but if you don't like that you can turn filters on in the settings to have more natural colors around you.
+Burrows: Orys can make big tunnel systems with multiple entrances/exits and you can even farm food in them.
+Land, Air and Ocean: You can fly as pteranodon (tropeognathus is being worked on), walk on land as herbivore or carnivore, or swim in the oceans as mosa or other aquatic, can’t decide if you want to be on land or water there are 2 semi-aquatics you can play as.
+6 save slots: You can have up to 6 creatures in one server.
+Balance: Most of the creatures are well balanced but problems come with infinite growth.
+More creatures are being worked on
+Carry food and babies
+It’s actually FUN: There is a lot to do, play with your friends or find others in a group finder to play with you, most people are friendly and ready to help you.

For some can be Pros or Cons:
Infinite growth: I personally like this growing big and strong, but at the same time some bigger creatures will just rule the server not giving you a chance to grow big.
Not too realistic: For me a pro but not for everyone. Being able to jump to the sky as elasmo (aquatic) and pachy knocking megalo in air only for it to fall to its death and so on.
Growth: Even though not that long but some people don’t have the time to grow dinos like rexes that take time. You can play combat mode but it doesn't feel the same.
+Herbivores can mix group, some servers allow carnivores to do the same, ask admin to do it (but not fun when ptera mix packs with carnis to scout).

Cons:
- Bugs: Can be sometimes annoying, have almost drowned a few times because I was stuck.
- Not well optimised: Even with good computers can be hard to get good fps.
Toxic players: Sadly they have found their way here.
- Not enough players: Only a few servers are popular. We need more players to populate more servers so other kinds of game rules can be or not be made to please as many players as possible. (so get this game and play to fix this)
- Juveniles: They are so weak and can't do anything so many will just afk grow
- Stress from weather: Kind of realistic and gives a bit of challenge, but will often make players sit under a rock or in a cave.
- Scent: On ground level ok, but underwater it's bad. I know it's going to be redone at one point.
- Not new player friendly: Yeah
- Having to use other programs ( exmp. obs) to take a video of rule breaks in hope of getting your dino back.
- Not enough creatures to play as leaving some creatures in constant fight, for example the ocean realm with only 3 options 2 being apex and 1 that will swim and fly away from them and 2 semi-aquatic that can go on land. It's a mess.

One last Pro:
Communication between developers and players. During live streams most of the questions from viewers will be answered, some are kept secret for later. Successions on how to make something work will be heard and written down, some even implemented. Even in Discord developers sometimes talk in the chat and communicate with the players.

How to fix:
You can agree or not, there are just my ideas.

o Toxic players: ability to mute players, text they write wont show up but to avoid confusion their name will be in chat so you know who other people might be writing to.
o Revenge killing: 5-30min after being killed by someone/group not being able to kill them and them not being able to kill you when you switch to a new/existing dino.
o Scouting birds: If you play as any bird no matter the size of it there should be cooldown if you want to change it to.
o Infinite growth: More servers with cap. Maybe after a certain point the stamina pool will start to get a lot smaller so others have a chance to run away if seen far enough.
o Juveniles: More smaller creatures to kill and ai dinos. Maybe have more stamina or speed than adults being smaller and lighter. More places only they can go to hide.
o Stress from weather: Make weather resistance skill better, like when 3/3 walking outside during a growth storm would reduce comfort a lot slower so it would be easier to walk.
o New player friendliness: Make tutorial to controls, scent system and meaning of colors. Small hint for me, try combat mode servers first to see how different dinos work, read through the skill tree to see what it has (press t to open). Game mode is on the right side of the server list.
o Growth: Make it faster maybe until 1.2 growth then normal in a few servers so people who don't have all day long to grow dinos can enjoy survival mode.

In conclusion:
I personally enjoy the game and hope you would give it a change if not now then later as the game keeps getting regular updates. New map and creature models are being made and they are going to make this game look graphically a lot better so be patient and wait for it if graphics are your problem. Join the bob’s discord to keep in touch what’s coming. Meanwhile I will keep playing and watching as the game grows.
",1601735503,1601735503,True,0,0,0,0,True,False,True,76561198147834434,42,1,29146,3328,28186,1602090735,,
15,76851312,english,"The Isle but better than the isle.













But.. Don't play this alone or you'll be ganged by a group of no lifer apexes with absolutely no hope of surviving. ;)",1601539914,1601639611,True,0,0,0,0,True,False,True,76561198060058839,87,15,632,632,546,1601988684,,
16,76898475,english,Its so amazing and creative!!!,1601621705,1601621705,True,0,0,0,0,True,False,True,76561198952576649,9,4,1327,823,515,1601975172,,
17,76894021,english,"servers are dog shit , similar to the isle but shittier growth rates... 

roughly 1 YEAR gametime played for max growth... 

too many rules.... dont waste your money on north korean dinosaurs",1601612886,1601612886,False,0,0,0,0,True,False,True,76561198334250666,22,3,13168,6948,12919,1602080584,,
18,76890213,english,"When watching a video about it on YouTube it looks boring, but once you actually play it, it's super fun!",1601605302,1601605302,True,0,0,0,0,True,False,True,76561198828172882,6,3,3533,3188,765,1602087371,,
19,76885859,english,yes,1601596483,1601596483,True,0,0,0,0,True,False,True,76561198878992276,14,1,1260,1260,927,1601858013,,
20,76870750,english,good,1601572071,1601572071,True,0,0,0,0,True,False,True,76561198799095131,29,6,5631,4149,3863,1601933811,,
21,76868826,english,"It's like the isle, except there is more to do and it actually gets updated every now and then.",1601569409,1601569409,True,0,0,0,0,True,False,True,76561198191017882,92,17,42885,3327,42047,1601763672,,
22,76846289,english,E A sports,1601529264,1601529264,True,0,0,0,0,True,False,True,76561198286965301,11,2,2998,1910,2380,1601864530,,
23,76841835,english,"The game is fun. However, the community is complete ass.
Don't take it with a grain of salt when you read a review about just how terrible the games community is. It's a fact.
Players will outright ignore the rules on the community servers (the only populated servers) and will mix-pack and cheat at every opportunity they get. Friend groups/clans are far too oppressive in this game.

To sum it up. The community is full of degenerates who will not abide the rules, and will do whatever they can to cheat the system so that they can stay the top dog that wipes everything out. The majority of players in this game are degenerates with no honour at all.",1601520146,1601520146,False,3,0,0.557640790939331055,0,True,False,True,76561198042183297,91,2,64543,3407,64119,1602049149,,
24,76829548,english,my mama mmmm :),1601497492,1601497492,True,0,0,0,0,True,True,True,76561198860478566,12,4,1588,1588,1302,1602030506,,
25,76794206,english,it's a good game uvu,1601436706,1601436706,True,0,0,0,0,True,False,True,76561199018952144,6,1,111914,6393,108885,1602037107,,
26,48086632,english,"Even though I enjoy this game, I can no longer reccommend it solely because of the community.
The community on here is as toxic as every other dino game on steam. Full of pretentious brats who troll and kill eachother for fun and when you call them out on their shit, these people will call others to gang up on you to say why you are wrong and stuff, showcasing a very high mob mentality in such servers. I normally dont complain about being killed in a videogame, but in this game its kinda a big deal. In team fortress 2 for example, if you die, you can respawn in a few seconds good as new. In Beasts of Bermuda however, You must grow your dino first, which usually takes a long time. and if you are killed, guess what.... all that progress is lost and all that time wasted. alot of players will KOS (kill for sport) and this ruins the game experience for most.This game is also very unfriendly to newcomers. Most players in these servers know eachother closely and new players are usually ignored and/or made fun of. I do not reccommend this game until the community brightens up.

update: From what i have seen the mods practice favoritism. You can blame the overabundance of thin skinned furries in this game. I got a 3 day server mute because i called someone ""cheeky""",1546572866,1601432548,False,0,0,0.47826087474822998,0,True,False,True,76561197996441810,181,17,20048,789,20048,1601432312,,
27,76741206,english,"Really Great game every dino is enteresting and super fun to play, although the graphics leave much to be desired. But i hear they are trying to improve upon it.",1601343772,1601343772,True,0,0,0,0,True,False,True,76561198266998586,50,2,4550,1475,3818,1601940512,,
28,76713296,english,dinosaur,1601303204,1601303204,True,0,0,0,0,True,False,True,76561198113158813,69,23,11764,3374,10709,1601808033,,
29,76709726,english,"The games pretty fun, more fun than the isle for me right now since to me theres more to do.  Instead the isle is like doing the same thing over and over again.  Plus this game has all the extra features n stuff like grabbing stuff.  I also like the skins alot more.",1601298397,1601298397,True,0,1,0,0,True,False,True,76561198326655181,21,6,2404,2373,281,1602090796,,
30,76681346,english,"I actually quite enjoyed the game, I entered a chill server to get to know the game which I highly recommend cause otherwise you get no help trying to figure it out, just a constant back and forth looking at controls. Anyways The game really has potential and I'm excited to see where it all goes. :D",1601242545,1601242545,True,0,0,0,0,True,False,True,76561199012782398,4,1,4356,4356,1513,1602044704,,
31,76653159,english,"really bad game, i play it too much :(",1601208053,1601208053,False,0,2,0.473729550838470459,0,True,False,True,76561198194741621,14,1,62579,4776,58824,1602088783,,
32,76646990,english,the devs are working pretty hard to make this the best dino game out there! and it's already in a fun playable state as it is!,1601199333,1601199333,True,0,0,0,0,True,False,True,76561198020701242,170,22,2026,2002,944,1601936990,,
33,76639134,english,Great game with friends,1601185424,1601185424,True,0,0,0,0,True,False,True,76561198308216683,86,2,2851,156,2762,1601686846,,
34,76625565,english,Like the Isle but has more variety. Not as good graphics but still decent. Been having a blast so far.,1601161581,1601161581,True,0,0,0,0,True,False,True,76561199048273868,18,6,4457,2178,2838,1601751217,,
35,76316652,english,"I like this game :)







BUT PLEASE REMOVE PTERANODON. ABOUT 50% OF ALL MY DEATHS ARE TO A PTERA THEY NEED A NERF, MAKE IT SO THAT THEY NEED TO WAIT 10 SECONDS IF THEY CRASH TILL THEY CAN GET UP AGAIN, OR NERF THEIR DAMAGE, BECAUSE I CAN'T TAKE THESE THINGS ANY MORE, THEY SHOULD BE REPLACED BY DIMORPHADONS!!!!!!!! Other than these flying nightmares, really great game.",1600667830,1601146619,True,0,0,0,0,True,True,True,76561198315816727,7,3,5038,1584,4963,1601191121,,
36,76594500,english,it may have trash graphics but it's quite fun,1601124016,1601124016,True,0,0,0,0,True,False,True,76561199011282458,14,4,1719,17,1706,1601735804,,
37,76589598,english,I HATE WHEN I REINSTALL THE GAME I CANT GET IT BACK IN MY STEAM LIBRARY!,1601117313,1601117313,True,0,0,0,0,True,False,True,76561198869563058,6,1,3690,29,3662,1601326477,,
38,47798470,english,"Pros: 
-Easy to run on low end computers
-Unique mechanics and interesting dino playstyles

Cons:
-Can be unbalanced
-Glitchy at times
-updates are infrequent

This game has a long way to go, but I think it's worth checking back on every couple months.
Definitely worth the money if you have friends to play with and you like dinosaurs.",1545721181,1601101532,True,0,0,0.523809552192687988,0,True,False,True,76561198258188848,67,7,33560,25,33535,1602039733,,
39,76558396,english,Had enough hours on this game now to know its good! Unique different to most dinosaur simulator games.,1601067735,1601067735,True,2,0,0.523809552192687988,0,True,False,True,76561198259060191,66,2,87792,4677,84030,1602090681,,
40,76552713,english,"g o o d

",1601060620,1601060620,True,0,0,0,0,True,False,True,76561198966827977,20,2,16100,3275,13453,1602029111,,
41,76550692,english,"Fun, immersive gameplay. Be prepared to die a bunch.",1601058291,1601058291,True,0,0,0,0,True,False,True,76561198329198016,6,1,5438,5184,2885,1601595959,,
42,76548859,english,Better than The Isle,1601056212,1601056212,True,0,0,0,0,True,False,True,76561199011618035,8,4,4943,4943,273,1601885581,,
43,76547551,english,"A lot of good features that make the game very interesting, also runs really smooth, at least on a mid-tier pc. One think to note is that the graphics aren't particularly realistic, unlike the isle. If that doesn't bother you, I cannot recommend this game enough. So many different things to do, dinos to play and caves to explore.",1601054807,1601054807,True,0,0,0,0,True,False,True,76561198979479101,11,3,5440,3054,2612,1602090037,,
44,76547143,english,Everything and anything The Isle couldn't do.,1601054320,1601054320,True,0,0,0,0,True,False,True,76561198338923491,9,5,2974,1936,1916,1601683098,,
45,76542044,english,"Don't waste your time on this one. The game is filled with meshing issues and exploits (x-ray vision). Community is extremely toxic and servers are corrupted to serve the needs of ""elite"" gaming groups. This game is a magnet for some of the worst people you will ever interact with. This game will provide more moments of disgust, than fun experiences.",1601048619,1601048619,False,2,0,0.479617089033126831,0,True,False,True,76561198008894308,100,24,16383,1663,15028,1602089744,,
46,76541218,english,"Good game, haven't played long enough to give a full review.",1601047738,1601047738,True,0,1,0,0,True,False,True,76561198841342123,19,3,101360,5402,96490,1601815972,,
47,76539375,english,"Really fun Game! Love it! <3
",1601045700,1601045700,True,1,0,0.523809552192687988,0,True,False,True,76561198023403718,37,1,9364,3625,6895,1601955027,,
48,76532206,english,"better than the isle
",1601037158,1601037158,True,0,0,0,0,True,False,True,76561198807182494,16,7,1103,1103,274,1601883861,,
49,76531017,english,"goooooood ga,meeeeeeeeeeeeeeeeeeeeeeeeeeeee
",1601035435,1601035435,True,0,0,0,0,True,False,True,76561199084614879,9,3,224,0,224,1600715097,,
50,76530166,english,spend 5 days to get into a fight and have some random buggy shit happen and lose it all thats this game if you have a brain avoid,1601034022,1601034022,False,0,2,0.473729550838470459,0,True,False,True,76561198014770703,407,22,4707,1836,4346,1601208926,,
51,76516442,english,"i like this game i just think its very buggy and needs more dinosaurs i hate that 40% of the time i try to lay it it says ""no servers found"" or just super laggy it gets super annoying over a long time but when it works i have a blast.",1601006909,1601006909,True,0,0,0,0,True,False,True,76561198177698425,27,3,14279,2815,11728,1602023413,,
52,76514272,english,"I loveeeee this game. You can grow dinos from eggs to full grown adults. I love starting as an egg and getting awesome inherits. My favorite dino to play is sai but they're still developing the game. Honestly, this game should cost more than it does. It's such a well game, I can't recommend any game more than this one.",1601002961,1601002961,True,0,0,0,0,True,False,True,76561198309431566,16,3,18745,6491,12763,1602055787,,
53,76512964,english,This game is very fun you should get it.,1601000664,1601000664,True,0,0,0,0,True,False,True,76561198880279811,12,2,67405,6078,62473,1602036203,,
54,76462325,english,"Lots of great gameplay mechanics and talents you can give to your dinosaur. You can choose their ""talent tree,"" and they will be able to specialize in different skills like combat, survival, speed, and other skills in-between. Most people are decent, and you'll be able to team up with people of your same species. This is a survival game though, and you have to be cautious of everyone. Plenty of anxiety and fun and killing to go around as a dinosaur.",1600919372,1600919372,True,0,0,0,0,True,False,True,76561198354611853,15,3,8336,0,8336,1599786242,,
