,title,recommendationid,language,review,timestamp_created,timestamp_updated,voted_up,votes_up,votes_funny,weighted_vote_score,comment_count,steam_purchase,received_for_free,written_during_early_access,author.steamid,author.num_games_owned,author.num_reviews,author.playtime_forever,author.playtime_last_two_weeks,author.playtime_at_review,author.last_played
13,Sid Meier's Civilization® III Complete,58588249,english,"My all time favorite game and also this is the best version of all that are out. Wish they would mirror this interface moving forward...if so, I would always buy the newest release.",1575043397,1575043397,TRUE,0,0,0,0,TRUE,FALSE,FALSE,7.66E+16,2,1,27127,184,24513,1601845042
14,Sid Meier's Civilization® III Complete,58577422,english,best strategy game of its time can always play again and again,1575038936,1575038936,TRUE,0,0,0,0,TRUE,FALSE,FALSE,7.66E+16,29,2,26617,0,18743,1596545388
15,Sid Meier's Civilization® III Complete,58487158,english,"Newer versions might be slicker, but this is still one of my favourite ways to get beaten up by the AI.",1574978506,1574978506,TRUE,0,2,0,0,TRUE,FALSE,FALSE,7.66E+16,54,1,12850,0,6319,1599902154
16,Sid Meier's Civilization® III Complete,58477679,english,"Awsome classic game I've been playing since 2003. start with a settler to build a city, to build and empire, to control the world.",1574973763,1574973763,TRUE,1,0,0.523809552,0,TRUE,FALSE,FALSE,7.66E+16,62,2,5376,0,5334,1582513591
17,Sid Meier's Civilization® III Complete,58385150,english,"good game for all ages and skill levels
",1574937969,1574937969,TRUE,0,0,0,0,TRUE,FALSE,FALSE,7.66E+16,11,1,385898,0,349488,1597884902
18,Sid Meier's Civilization® III Complete,58337496,english,Mod schemes are the best,1574908725,1574908725,TRUE,0,0,0,0,TRUE,FALSE,FALSE,7.66E+16,7,1,79907,0,77103,1576728557
19,Sid Meier's Civilization® III Complete,58328798,english,this game is fucking amazing,1574903716,1574903716,TRUE,0,0,0,0,TRUE,FALSE,FALSE,7.66E+16,6,1,1052,0,1007,1580160953
20,Sid Meier's Civilization® III Complete,58321539,english,I watched my guy swing a pickaxe for 6 turns and then my friends left,1574899854,1574899854,FALSE,1,2,0.456273794,0,TRUE,FALSE,FALSE,7.66E+16,102,25,23,0,23,1574899622
21,Sid Meier's Civilization® III Complete,58304343,english,This is one of the best games ever made. Started playing it in 2001 and still enjoying every minute of it nearly two decades later. I hope Firaxis does a reboot someday!,1574892052,1574892052,TRUE,0,0,0,0,TRUE,FALSE,FALSE,7.66E+16,15,1,18866,0,18583,1584418298
22,Sid Meier's Civilization® III Complete,58261184,english,,1574879498,1574879498,TRUE,0,0,0,0,TRUE,FALSE,FALSE,7.66E+16,8,1,24284,0,16624,1599489895
23,Sid Meier's Civilization® III Complete,58046448,english,16 years playing this game and I still love it!,1574822362,1574822362,TRUE,0,0,0,0,TRUE,FALSE,FALSE,7.66E+16,1,1,12447,0,12350,1574830733
24,Sid Meier's Civilization® III Complete,57994744,english,"classic, balanced, amazing game",1574807718,1574807718,TRUE,0,0,0,0,TRUE,FALSE,FALSE,7.66E+16,124,6,69548,0,57928,1600471536
25,Sid Meier's Civilization® III Complete,57853158,english,good game,1574739401,1574739401,TRUE,0,0,0,0,TRUE,FALSE,FALSE,7.66E+16,62,4,19924,0,16262,1599159337
26,Sid Meier's Civilization® III Complete,57851808,english,"Scale is more massive then Civ 5 or 6, which makes exploring more fun. AI is asz easy or tough as you want it to be.",1574736577,1574736577,TRUE,0,0,0,0,TRUE,FALSE,FALSE,7.66E+16,47,3,60273,0,50437,1598985989
27,Sid Meier's Civilization® III Complete,57838030,english,Older version of Civilization with easy playability. Good for quick games and the AI is not too difficult for single player modes.,1574710257,1574710257,TRUE,0,0,0,0,TRUE,FALSE,FALSE,7.66E+16,27,2,20548,1001,15638,1602040753
28,Sid Meier's Civilization® III Complete,57825279,english,I first played this game when it came out originally. this is the last game where the AI was actually good. Later games started to base the AI as if they are players. I miss this old AI system. To this day it is my most favourite civ game to date.,1574692713,1574692713,TRUE,0,0,0,0,TRUE,FALSE,FALSE,7.66E+16,97,4,6376,0,4787,1576217082
29,Sid Meier's Civilization® III Complete,57743718,english,One of the civ greats. nuf said,1574569251,1574569251,TRUE,0,0,0,0,TRUE,FALSE,FALSE,7.66E+16,17,3,1030,0,312,1574662350
30,Sid Meier's Civilization® III Complete,57738801,english,"It's a lot different than the other Civilization games in the sense that it's not as easy to quickly take over every other nation in a quick genocide run. In Civ 3, you need to actually build up before you can even be SOMEWHAT ready to go to war. There wasn't as much effort on the soundtrack as there was in Civ 2, so you kinda unconsciously get annoyed at the game. Other than that, it's absolutely wonderful and addictive.",1574561574,1574561574,TRUE,0,0,0,0,TRUE,FALSE,FALSE,7.66E+16,12,1,651,0,346,1599403957
31,Sid Meier's Civilization® III Complete,57734983,english,get this game,1574555421,1574555421,TRUE,0,0,0,0,TRUE,FALSE,FALSE,7.66E+16,28,3,18063,0,523,1598224898
32,Sid Meier's Civilization® III Complete,57734618,english,Classic,1574554800,1574554800,TRUE,0,0,0,0,TRUE,FALSE,FALSE,7.66E+16,21,2,18832,0,13539,1599520935
33,Sid Meier's Civilization® III Complete,57733648,english,yes,1574553279,1574553279,TRUE,0,0,0,0,TRUE,FALSE,FALSE,7.66E+16,11,4,6533,0,6237,1575817045
34,Sid Meier's Civilization® III Complete,57698603,english,I loved it then and love it now,1574515155,1574515155,TRUE,0,0,0,0,TRUE,FALSE,FALSE,7.66E+16,58,3,10686,0,9232,1575090881
35,Sid Meier's Civilization® III Complete,57674703,english,Undoubtedly one of the greatest strategy games of all time.,1574483217,1574483217,TRUE,0,0,0,0,TRUE,FALSE,FALSE,7.66E+16,35,10,19249,0,15129,1600581792
36,Sid Meier's Civilization® III Complete,57651908,english,The best civilization game,1574451647,1574451647,TRUE,6,1,0.578813016,0,TRUE,FALSE,FALSE,7.66E+16,5,1,13586,0,2286,1590164882
37,Sid Meier's Civilization® III Complete,57629223,english,"The problem is none of the patches for the mods are still available!  The mods are probably the most redeeming aspect of the game and it might crash if the wrong item is built.  Otherwise, the patches would mostly just add artwork.",1574425229,1574425229,TRUE,0,0,0,0,TRUE,FALSE,FALSE,7.66E+16,20,1,115195,20,111052,1602034497
38,Sid Meier's Civilization® III Complete,57616773,english,Good Game,1574400732,1574400732,TRUE,0,0,0,0,TRUE,FALSE,FALSE,7.66E+16,1,1,353,0,353,1570498895
39,Sid Meier's Civilization® III Complete,57603319,english,It's still fun!,1574373557,1574373557,TRUE,0,0,0,0,TRUE,FALSE,FALSE,7.66E+16,21,1,42415,0,42262,1596652024
40,Sid Meier's Civilization® III Complete,57602806,english,"I like the game, i honestly do.  But the steam version is kinda buggy... i spent hours on a game, saved, and then got off, only to discover all my saves weren't of my progress, but rather of the beginning of the game.  Also i have to revalidate game files every time i try to get in the game or else the top left of the menu is the only part of it that shows and I have to shut the program down with task manager.  Its honestly a shame, I loved this game when I played it before steam was a thing.",1574372677,1574372677,FALSE,17,0,0.63376385,0,TRUE,FALSE,FALSE,7.66E+16,83,14,1120,0,646,1600234404
41,Sid Meier's Civilization® III Complete,57587153,english,Classic and no ads.,1574350778,1574350778,TRUE,0,0,0,0,TRUE,FALSE,FALSE,7.66E+16,2,1,37977,408,18050,1601675337
42,Sid Meier's Civilization® III Complete,57561295,english,me like game,1574303879,1574303879,TRUE,0,0,0,0,TRUE,FALSE,FALSE,7.66E+16,17,1,57042,54,53839,1600909800
43,Sid Meier's Civilization® III Complete,57555456,english,i like it! all that counts!,1574291009,1574291009,TRUE,0,0,0,0,TRUE,FALSE,FALSE,7.66E+16,1,1,130975,0,123534,1594358820
44,Sid Meier's Civilization® III Complete,57531303,english,"Of all the Civilization games in the series, this is my absolute favorite and most challenging if you ask me. I still play this ever since I first bought it in 2004",1574258061,1574258061,TRUE,0,0,0,0,TRUE,FALSE,FALSE,7.66E+16,9,1,100480,0,83974,1600877847
45,Sid Meier's Civilization® III Complete,57515406,english,"it has amazing attention to detail, and has a beautiful picture. though be careful. make sure your graphics are set to the recommended level or you are going to be ""laggin' like a dragon"". Very slow and hard to do anything. so keep graphics low and you should do fine. the only other thing that erks me is when you load the game for the first time. It takes FOREVER to load. the game on the first time after installing it. Final note. remember this is a big game so don't get to angry if and when it slow (the first time). thank you and enjoy. ;)",1574231926,1574231926,TRUE,0,0,0,0,TRUE,FALSE,FALSE,7.66E+16,50,4,421,0,243,1593916424
46,Sid Meier's Civilization® III Complete,57501683,english,"the graphicts aren't the best, but it is really fun and easy to learn.  it is not laggy for being so old and their is a really good strategical aspect of the game.",1574205088,1574205088,TRUE,0,0,0,0,TRUE,FALSE,FALSE,7.66E+16,6,1,71990,0,12227,1600268463
47,Sid Meier's Civilization® III Complete,57455338,english,Sid Meier is the Godfather of 4x games.,1574136382,1574136382,TRUE,0,0,0,0,TRUE,FALSE,FALSE,7.66E+16,102,5,14750,0,14566,1574166534
48,Sid Meier's Civilization® III Complete,57453997,english,"I like the flexibility of the rules to win, level of experience and being able to replay the last world.",1574133915,1574133915,TRUE,0,0,0,0,TRUE,FALSE,FALSE,7.66E+16,1,1,14420,1297,7549,1601493017
49,Sid Meier's Civilization® III Complete,57445657,english,Meh....... it's ok.,1574119570,1574119570,TRUE,2,0,0.509803951,1,TRUE,FALSE,FALSE,7.66E+16,88,1,161999,596,152547,1601698595
50,Sid Meier's Civilization® III Complete,57444029,english,"Civ 3 is probably my favorite of all the Civ games, even the new ones. It's involved enough to keep me engaged, but simple enough to be a very casual game for me.  I love it!",1574116769,1574116769,TRUE,0,0,0,0,TRUE,FALSE,FALSE,7.66E+16,123,2,601,0,600,1574116898
51,Sid Meier's Civilization® III Complete,57427271,english,Amazing! A gem of a game!,1574093045,1574093045,TRUE,0,0,0,0,TRUE,FALSE,FALSE,7.66E+16,15,2,6538,0,4874,1590930836
52,Sid Meier's Civilization® III Complete,57425146,english,great game,1574090219,1574090219,TRUE,0,0,0,0,TRUE,FALSE,FALSE,7.66E+16,12,4,5919,0,458,1588979169
53,Sid Meier's Civilization® III Complete,57402778,english,I love the game play.,1574048824,1574048824,TRUE,0,0,0,0,TRUE,FALSE,FALSE,7.66E+16,19,1,1017,0,700,1592622509
54,Sid Meier's Civilization® III Complete,57398467,english,is good game,1574040476,1574040476,TRUE,0,0,0,0,TRUE,FALSE,FALSE,7.66E+16,12,2,30250,0,30015,1597308313
55,Sid Meier's Civilization® III Complete,57393847,english,always,1574032161,1574032161,TRUE,0,0,0,0,TRUE,FALSE,FALSE,7.66E+16,26,1,50944,0,41767,1581047258
56,Sid Meier's Civilization® III Complete,57386446,english,Is there any way to run this on a galaxy Tab A?,1574021920,1574021920,TRUE,0,0,0,0,TRUE,FALSE,FALSE,7.66E+16,15,3,11612,107,5971,1602042256
57,Sid Meier's Civilization® III Complete,57384570,english,favorite game together with aoe 2,1574019850,1574019850,TRUE,0,0,0,0,TRUE,FALSE,FALSE,7.66E+16,15,3,639,0,291,1597922468
58,Sid Meier's Civilization® III Complete,57337165,english,It's classic Civ at it's best.,1573967382,1573967382,TRUE,4,0,0.558823526,0,TRUE,FALSE,FALSE,7.66E+16,39,2,50706,448,48041,1601624612
59,Sid Meier's Civilization® III Complete,57302532,english,nostalgic,1573925372,1573925372,TRUE,0,0,0,0,TRUE,FALSE,FALSE,7.66E+16,35,5,2886,0,702,1592246737
60,Sid Meier's Civilization® III Complete,57296740,english,My favorite Civ game. The last before they went 3D i think. Actually challenging battles if you play a map thats not so much water (AI always suck in naval combat). The other civilization games dont have these challenging battles from the AI on land in my opinion cuse they are soo stupid. The battles is only one thing i like about Civ 3 but its an important aspect if you want some challenge.,1573920023,1573920023,TRUE,0,0,0,0,TRUE,FALSE,FALSE,7.66E+16,22,1,15771,256,14546,1601745655
61,Sid Meier's Civilization® III Complete,57252753,english,uncomplicated,1573868879,1573868879,TRUE,0,0,0,0,TRUE,FALSE,FALSE,7.66E+16,94,1,10687,284,8354,1601461688
62,Sid Meier's Civilization® III Complete,57184868,english,A classic. A must have for any collector of 90's and early 2000's games.,1573774169,1573774169,TRUE,0,0,0,0,TRUE,FALSE,FALSE,7.66E+16,111,7,133573,0,104703,1596829569
63,Sid Meier's Civilization® III Complete,57175249,english,"game: 10/10
nostalgia: 10/10",1573759098,1573759098,TRUE,0,0,0,0,TRUE,FALSE,FALSE,7.66E+16,36,5,12938,0,12170,1596352828
64,Sid Meier's Civilization® III Complete,57169551,english,An all time favorite,1573751603,1573751603,TRUE,0,0,0,0,TRUE,FALSE,FALSE,7.66E+16,42,2,24591,0,16684,1574818970
65,Sid Meier's Civilization® III Complete,57152790,english,shit,1573727855,1573727855,FALSE,0,0,0.481463641,0,TRUE,FALSE,FALSE,7.66E+16,6,1,26163,1074,13637,1602103446
66,Sid Meier's Civilization® III Complete,57148394,english,The classic. The best.,1573718141,1573718141,TRUE,0,0,0,0,TRUE,FALSE,FALSE,7.66E+16,18,1,292846,0,246866,1600569270
67,Sid Meier's Civilization® III Complete,57133482,english,"A classic that brings you back to the old days. Alongside Age II and Caesar III, this is a must have for strategy fans.
PS: civ II was never re-released and that's a shame.",1573686905,1573686905,TRUE,0,0,0,0,TRUE,FALSE,FALSE,7.66E+16,68,1,901,0,898,1573687433
68,Sid Meier's Civilization® III Complete,57121255,english,"LOVE THIS GAME
",1573682939,1573682939,TRUE,0,0,0,0,TRUE,FALSE,FALSE,7.66E+16,10,1,56158,0,47852,1594532899
69,Sid Meier's Civilization® III Complete,57113359,english,solid game,1573671393,1573671393,TRUE,0,0,0,0,TRUE,FALSE,FALSE,7.66E+16,14,2,3134,0,2779,1576547241
70,Sid Meier's Civilization® III Complete,57104571,english,love it,1573659924,1573659924,TRUE,0,0,0,0,TRUE,FALSE,FALSE,7.66E+16,1,1,17535,0,17369,1591392573
71,Sid Meier's Civilization® III Complete,57101001,english,"easy to play and a good time passer
",1573655462,1573655462,TRUE,0,0,0,0,TRUE,FALSE,FALSE,7.66E+16,9,1,339820,2580,267835,1602102317
72,Sid Meier's Civilization® III Complete,57076606,english,it kinda sucks,1573610199,1573610199,TRUE,0,0,0,0,TRUE,FALSE,FALSE,7.66E+16,6,3,10395,0,4659,1600842249
73,Sid Meier's Civilization® III Complete,57076029,english,"Might just be nostalgia but this has always been my fav civ version. Never really enjoyed any of the newer ones, so if you can get past the graphics I'd say it's a great game.

Only thing is that the games can be really long until you know what you're doing lol.",1573609114,1573609114,TRUE,0,0,0,0,TRUE,FALSE,FALSE,7.66E+16,243,1,9248,0,7452,1595501654
74,Sid Meier's Civilization® III Complete,57024576,english,Awesome!,1573527889,1573527889,TRUE,0,0,0,0,TRUE,FALSE,FALSE,7.66E+16,15,2,189,0,183,1573528182
75,Sid Meier's Civilization® III Complete,57020009,english,A total classic. Great tactics and strategy game.,1573519719,1573519719,TRUE,0,0,0,0,TRUE,FALSE,FALSE,7.66E+16,22,2,6172,0,1550,1575176452
76,Sid Meier's Civilization® III Complete,56984259,english,"If I go for a space trip, I'll bring this game with me.
I played this game in 2006 and I still play from time to time.",1573475833,1573475833,TRUE,0,0,0,0,TRUE,FALSE,FALSE,7.66E+16,369,7,5820,0,4042,1599889262
77,Sid Meier's Civilization® III Complete,56975975,english,"STILL THE BEST BALANCE BETWEEN DETAIL MANAGEMENT AND AUTOMATION. HVE 4-6 BUT STILL STICK WITH 3
",1573462639,1573462639,TRUE,0,0,0,0,TRUE,FALSE,FALSE,7.66E+16,4,1,45978,397,34688,1601999169
78,Sid Meier's Civilization® III Complete,56948704,english,best civ game out of the franchise.,1573416907,1573416907,TRUE,0,0,0,0,TRUE,FALSE,FALSE,7.66E+16,8,2,64244,1,40877,1601323516
79,Sid Meier's Civilization® III Complete,56880207,english,this game is great,1573342695,1573342695,TRUE,0,0,0,0,TRUE,FALSE,FALSE,7.66E+16,18,4,9036,0,7715,1592539037
80,Sid Meier's Civilization® III Complete,56855201,english,Best game in the series in my opinion.,1573318459,1573318459,TRUE,0,0,0,0,TRUE,FALSE,FALSE,7.66E+16,46,4,38811,0,29754,1598472978
81,Sid Meier's Civilization® III Complete,56795826,english,Best CIV game,1573257895,1573257895,TRUE,0,0,0,0,TRUE,FALSE,FALSE,7.66E+16,77,3,4342,0,846,1584471018
82,Sid Meier's Civilization® III Complete,56788100,english,Best game of my childhood by far,1573248739,1573248739,TRUE,0,0,0,0,TRUE,FALSE,FALSE,7.66E+16,17,1,11260,0,9578,1600213763
83,Sid Meier's Civilization® III Complete,56775743,english,I forgot for a while how much this game cheats... Play it if you don't mind but just don't expect a fair fight.,1573236227,1573236227,FALSE,0,1,0.481463641,0,TRUE,FALSE,FALSE,7.66E+16,144,3,359,0,359,1573236010
84,Sid Meier's Civilization® III Complete,56739888,english,play slow,1573192747,1573192747,TRUE,0,0,0,0,TRUE,FALSE,FALSE,7.66E+16,29,3,235629,1046,211609,1601873027
85,Sid Meier's Civilization® III Complete,56735378,english,"A true classic. Technical, weird, in need of fixes and lots of patience, but a great gem once you've done enough digging.",1573184936,1573184936,TRUE,0,0,0,0,TRUE,FALSE,FALSE,7.66E+16,11,1,26327,136,15652,1601696630
86,Sid Meier's Civilization® III Complete,56732520,english,"It be gooder
",1573180447,1573180447,TRUE,0,0,0,0,TRUE,FALSE,FALSE,7.66E+16,3,1,2372,0,230,1590346751
87,Sid Meier's Civilization® III Complete,56696811,english,"early version but still awesome! 
",1573138660,1573138660,TRUE,0,0,0,0,TRUE,FALSE,FALSE,7.66E+16,26,4,10475,0,3467,1586305304
88,Sid Meier's Civilization® III Complete,56664773,english,A classic! Still enjoyable after all these years.,1573090524,1573090524,TRUE,0,0,0,0,TRUE,FALSE,FALSE,7.66E+16,14,5,23185,0,1652,1600106820
89,Sid Meier's Civilization® III Complete,56662916,english,Great game,1573087718,1573087718,TRUE,0,0,0,0,TRUE,FALSE,FALSE,7.66E+16,2,1,54331,1706,49484,1601909527
90,Sid Meier's Civilization® III Complete,56618221,english,Best strategy game ever.  Nothing else needs to be said.,1573036376,1573036376,TRUE,0,0,0,0,TRUE,FALSE,FALSE,7.66E+16,533,4,71308,543,54944,1601988770
91,Sid Meier's Civilization® III Complete,56585020,english,"turn based, portrays much of real history. explains resource and population driven wars nicely. Fun game",1572986399,1572986399,TRUE,0,0,0,0,TRUE,FALSE,FALSE,7.66E+16,35,4,87756,0,77076,1596876221
92,Sid Meier's Civilization® III Complete,56495552,english,yes,1572883275,1572883275,TRUE,0,0,0.476190478,0,TRUE,FALSE,FALSE,7.66E+16,7,2,5864,0,5853,1595097428
93,Sid Meier's Civilization® III Complete,56487088,english,I love this game. I have played this since i was 5. I had the original CD but had lost the CD key so i could only play it on my old laptop. Then when i saw it on steam i bought it without thinking twice. I love the CIV series but this still remains to be my favorite.,1572876041,1572876041,TRUE,0,0,0,0,TRUE,FALSE,FALSE,7.66E+16,128,1,6163,0,5817,1595649876
94,Sid Meier's Civilization® III Complete,56432186,english,its great,1572811381,1572811381,TRUE,0,0,0,0,TRUE,FALSE,FALSE,7.66E+16,1,1,18493,0,17975,1581518202
95,Sid Meier's Civilization® III Complete,56406909,english,"I got this game originally on a disc back when it came out! I had played Civ II before and loved it. Civ III is even better, it's just so much fun exploring, building new cities and doing research. I'd recommend getting the Prima strategy book guide, it'll really help you whether you're into a peaceful path in the game or a more military path. It gives a list of the research paths to take for both.

""Just one more turn"" has kept me playing... :)",1572794527,1572794527,TRUE,0,0,0,0,TRUE,FALSE,FALSE,7.66E+16,7,2,7801,0,7236,1572896886
96,Sid Meier's Civilization® III Complete,56405988,english,"Really enjoy playing - direct, uncomplicated strategy game.",1572793916,1572793916,TRUE,0,0,0,0,TRUE,FALSE,FALSE,7.66E+16,40,2,109647,1245,96416,1602099270
97,Sid Meier's Civilization® III Complete,56342805,english,"very absorbing innit.
",1572742976,1572742976,TRUE,0,0,0,0,TRUE,FALSE,FALSE,7.66E+16,5,1,35865,554,26614,1601768449
98,Sid Meier's Civilization® III Complete,56337082,english,its good,1572737528,1572737528,TRUE,0,0,0,0,TRUE,FALSE,FALSE,7.66E+16,26,1,70602,0,60235,1591320103
99,Sid Meier's Civilization® III Complete,56319942,english,"I like the strategy options and scenarios.  I first played this game twenty years ago, and worked up to Civ 6.  It has it's quirks, and some of the real world options never did evolve.  It seems that conflict is the over-arching theme of the game, but it is more enjoyable than the straight up shooter games that seem to be the norm.",1572724716,1572724716,TRUE,0,0,0,0,TRUE,FALSE,FALSE,7.66E+16,4,1,32989,0,16828,1600561123
0,Sid Meier's Civilization® III Complete,56276525,english,"As an original Civ player, some times you just want to play the game without fancy cartoon graphics or over the top add ons. This version scratches that itch",1572700737,1572700737,TRUE,0,0,0,0,TRUE,FALSE,FALSE,7.66E+16,37,1,1619,0,893,1589775224
1,Sid Meier's Civilization® III Complete,56244737,english,One of the best civs,1572679631,1572679631,TRUE,0,0,0,0,TRUE,FALSE,FALSE,7.66E+16,293,10,9120,0,8564,1577154192
2,Sid Meier's Civilization® III Complete,56222595,english,best civ fight me,1572661517,1572661517,TRUE,1,0,0.523809552,0,TRUE,FALSE,FALSE,7.66E+16,76,4,4404,0,3314,1600615349
3,Sid Meier's Civilization® III Complete,56222303,english,Great game from my youth. Runs great no issues.,1572661281,1572661281,TRUE,0,0,0,0,TRUE,FALSE,FALSE,7.66E+16,17,2,10218,0,4505,1596473925
4,Sid Meier's Civilization® III Complete,56204772,english,My favorite installment of one of the greatest TBS games of all time.,1572648053,1572648053,TRUE,0,0,0,0,TRUE,FALSE,FALSE,7.66E+16,13,3,29231,714,24967,1602102736
5,Sid Meier's Civilization® III Complete,56197846,english,"sure the AI cheats like hell and are willfully arrogant even at low levels, but this game has so much playability, from time and time again!",1572643416,1572643416,TRUE,0,0,0,0,TRUE,FALSE,FALSE,7.66E+16,54,9,184446,382,113882,1601825980
6,Sid Meier's Civilization® III Complete,56088428,english,Have loved this game for years.  Thanks to Steam for having it.,1572573883,1572573883,TRUE,0,0,0,0,TRUE,FALSE,FALSE,7.66E+16,16,2,10715,3,2957,1601923391
7,Sid Meier's Civilization® III Complete,56084815,english,"This game, though old, has an amazing replay value. No 2 games ever play exactly the same, even if you duplicate all the starting conditions. In graphics it loses to newer versions, but it has an appeal all the same for those who either want to see how older games ran, or those like me that grew up with these types of games, and graphics, and wish to have a stroll down memory lane.",1572570805,1572570805,TRUE,0,0,0,0,TRUE,FALSE,FALSE,7.66E+16,19,2,64622,1454,42340,1601956236
8,Sid Meier's Civilization® III Complete,56063793,english,probably the best civ game is Civilization II.  III comes close but lacks many of the features of civ II that makes it the best. the biggest downfall is that it's  almost impossible to gain and keep an advantage i.e. flight or tanks etc. all in all however it's a very good game.,1572555777,1572555777,TRUE,0,0,0,0,TRUE,FALSE,FALSE,7.66E+16,7,1,47912,0,41536,1588970116
9,Sid Meier's Civilization® III Complete,56062824,english,"Totally addictive, easy game play on an ever-changing board. It is not just a war game for questions of ethics arise. e.g. You lack a vital resource and a weak neighbour has it while you main rival is eyeing it.  Do you defend the neighbour or take it before your rival?  It would not surprise me if Putin practices on this!",1572555259,1572555259,TRUE,0,0,0,0,TRUE,FALSE,FALSE,7.66E+16,17,4,315352,2172,263068,1602099543
10,Sid Meier's Civilization® III Complete,56033852,english,"Great game addictive
",1572541056,1572541056,TRUE,0,0,0,0,TRUE,FALSE,FALSE,7.66E+16,1,1,72413,267,22762,1601848679
11,Sid Meier's Civilization® III Complete,56024293,english,Turn based relaxation.,1572537026,1572537026,TRUE,0,0,0,0,TRUE,FALSE,FALSE,7.66E+16,4,1,315980,2214,246027,1602057739
12,Sid Meier's Civilization® III Complete,56018911,english,20 years old and still hours of fun,1572534798,1572534798,TRUE,0,0,0,0,TRUE,FALSE,FALSE,7.66E+16,6,1,3676,0,1428,1587256180
13,Sid Meier's Civilization® III Complete,55956700,english,"Just have loved this game from Civ 1.
",1572504510,1572504510,TRUE,0,0,0,0,TRUE,FALSE,FALSE,7.66E+16,5,1,136470,0,77830,1598065958
14,Sid Meier's Civilization® III Complete,55954178,english,I like this game because it is not just another shoot em up game and relies on strategy and is a very good way to relax,1572502571,1572502571,TRUE,0,0,0,0,TRUE,FALSE,FALSE,7.66E+16,11,1,374398,6129,252872,1602059878
15,Sid Meier's Civilization® III Complete,55952992,english,"Some great choices on this game. 
I enjoy ""Conquests"", particularly The Rise of Rome.",1572501651,1572501651,TRUE,0,0,0,0,TRUE,FALSE,FALSE,7.66E+16,8,2,33047,0,23382,1595898404
16,Sid Meier's Civilization® III Complete,55945873,english,Best Civ game of all time. still playing 15 years later.,1572496203,1572496203,TRUE,0,0,0,0,TRUE,FALSE,FALSE,7.66E+16,3,1,45891,1123,31908,1602094578
17,Sid Meier's Civilization® III Complete,55941868,english,"Good old clasic, i love Civilization since the first one on DOS, this one is no exception.",1572493206,1572493206,TRUE,0,0,0,0,TRUE,FALSE,FALSE,7.66E+16,434,11,338,0,256,1572497278
18,Sid Meier's Civilization® III Complete,55928990,english,Latest version my graf-card can handle.  But it's all about strategy,1572484210,1572484210,TRUE,0,0,0,0,TRUE,FALSE,FALSE,7.66E+16,26,1,38621,1264,19159,1602055512
