,title,recommendationid,language,review,timestamp_created,timestamp_updated,voted_up,votes_up,votes_funny,weighted_vote_score,comment_count,steam_purchase,received_for_free,written_during_early_access,author.steamid,author.num_games_owned,author.num_reviews,author.playtime_forever,author.playtime_last_two_weeks,author.playtime_at_review,author.last_played
80,Sid Meier's Civilization® III Complete,34425436,english,"Sid Meier's Civilization III was a major part of my childhood and, to this day, remains one of my favorite games. Unlike the more modern iterations of the game, this one goes into depth and requires some serious critical thinking and reasoning to succeed. Wartime scenarios are intense and rewarding; nothing is more satisfying than expanding your territory. Every civilization has its own unique traits that contribute to a diversified experience with each play. There are different map types to choose from as well that provide a varying experience. I'd definitely reccomend to this game to anyone, especially those that may have overlooked it while purchasing a newer civ. game.",1503441314,1503441314,TRUE,7,0,0.576124549,0,TRUE,FALSE,FALSE,7.66E+16,60,5,7919,0,5412,1560877732
81,Sid Meier's Civilization® III Complete,34357873,english,"i used to mod this game as a kid and make overpowered civs that got bonuses from being in anarchy

i am now a libertarian",1503172153,1503172153,TRUE,5,4,0.5357638,0,TRUE,FALSE,FALSE,7.66E+16,223,76,717,0,623,1519014661
82,Sid Meier's Civilization® III Complete,34338234,english,"At first it does not start in multiplayer mode, which is a shame...
I expected that at steam they'd fix these issues... :(
And also it says 5 minutes at least, whle my problem is that you can play 0 minutes, meningful... what a retard rule is this :D",1503096318,1503096318,FALSE,0,0,0.381850541,2,TRUE,FALSE,FALSE,7.66E+16,4,2,4938,0,6,1589398140
83,Sid Meier's Civilization® III Complete,9236369,english,"A fantastic entry to the Civilization series and my personal favorite. If the multiplayer worked, I'd play this over 5 any day of the week.",1393178315,1503080865,TRUE,11,0,0.603631377,0,TRUE,FALSE,FALSE,7.66E+16,259,9,25740,0,16004,1595066883
84,Sid Meier's Civilization® III Complete,34266883,english,I bought this game on disk three different times as a kid because i kept wearing them out from playing it so much. I could have studied to become a doctor with all the time i have spent on this game.,1502844393,1502844393,TRUE,12,15,0.612437427,1,TRUE,FALSE,FALSE,7.66E+16,46,3,19523,0,11035,1498337583
85,Sid Meier's Civilization® III Complete,34219371,english,the game crashes everytime i lose,1502647406,1502647406,TRUE,0,1,0,0,TRUE,FALSE,FALSE,7.66E+16,57,12,1009,0,957,1511489974
86,Sid Meier's Civilization® III Complete,34213608,english,"The hours here pale in comparison to my pre-Steam playtime, easily in the hundreds and possibly thousands of hours.
A classic. Loved the customizations and conquests in the complete version, but playing a nice regular game is fun too. I feel this is the most ""Complete"" version of Civ. I fear the modern games in the series have too much focus on graphics and such and drift away from what made the game fun as a result.",1502630027,1502630027,TRUE,4,0,0.545454562,0,TRUE,FALSE,FALSE,7.66E+16,367,8,2027,0,410,1598060576
87,Sid Meier's Civilization® III Complete,34212285,english,"Pickup a newer Civ title insted, because this one is a bit dated and has some unresolved issues.",1502625460,1502625460,FALSE,0,0,0.471217245,0,TRUE,FALSE,FALSE,7.66E+16,817,267,954,0,125,1558912014
88,Sid Meier's Civilization® III Complete,34114132,english,My wallet can't handle Civ 5 so I play this instead. 255 Ghandis out of 10,1502235069,1502235181,TRUE,0,1,0,0,TRUE,FALSE,FALSE,7.66E+16,181,12,1940,0,1822,1502754169
89,Sid Meier's Civilization® III Complete,34050704,english,This game has aged very well and is still as much fun now as it was when it first came out.,1501985033,1501985033,TRUE,5,0,0.597458363,0,TRUE,FALSE,FALSE,7.66E+16,84,8,9075,0,5948,1586221445
90,Sid Meier's Civilization® III Complete,34001109,english,"very dope indeed
",1501791910,1501791910,TRUE,0,0,0.495930821,0,TRUE,FALSE,FALSE,7.66E+16,79,5,5237,0,1801,1581831986
91,Sid Meier's Civilization® III Complete,33871439,english,Best $1.24 ive ever spent,1501298546,1501298546,TRUE,5,2,0.516144037,1,TRUE,FALSE,FALSE,7.66E+16,29,1,8539,0,7579,1521680809
92,Sid Meier's Civilization® III Complete,33857867,english,Game seems pretty decent but the program was crashing. I guess it's an old game and not really compatible with modern systems.,1501254788,1501254788,FALSE,0,2,0.331133366,0,TRUE,FALSE,FALSE,7.66E+16,90,92,77,0,12,1564758972
93,Sid Meier's Civilization® III Complete,33794450,english,On elimination mode u lose instantly if u lost 1 city. There iz no real conquest in this game :(,1501014716,1501014716,FALSE,0,2,0.245703653,3,TRUE,FALSE,FALSE,7.66E+16,119,2,244,0,130,1501961445
94,Sid Meier's Civilization® III Complete,33791246,english,"This was a huge game back in the day. i bought on Steam for pennies, it runs well and i have happily put 40 hours in this time round. At that rate it cost me 2p per hour to play it. If you don't have it then you are doing something wrong.  Personally i prefer it to Civ5",1501004741,1501004741,TRUE,0,0,0,0,TRUE,FALSE,FALSE,7.66E+16,218,15,2983,0,2788,1518610258
95,Sid Meier's Civilization® III Complete,33754431,english,Awesome strategy game!,1500849473,1500849473,TRUE,0,0,0.466328651,0,TRUE,FALSE,FALSE,7.66E+16,56,1,19515,0,12305,1548012344
96,Sid Meier's Civilization® III Complete,33667570,english,"I was gonna get 4, but I didn't have enough money, but ¯\_(ツ)_/¯",1500538584,1500538584,TRUE,2,7,0.527194619,0,TRUE,FALSE,FALSE,7.66E+16,112,40,197,0,169,1563998468
97,Sid Meier's Civilization® III Complete,33666293,english,"it's an old game but man its a good one, like age of empires. 90% of my time was spent on some sketchy CD version that had that infinite gold glitch, but getting the complete version with all the extra civ factions is hella nice. Great game, and if you haven't played civ 5 yet give it a go. Civ 3 and Civ 5 are the only civ games you should EVER play. Once you play civ 5 tho there is no going back, so play this first.",1500532212,1500532212,TRUE,0,0,0.476190478,0,TRUE,FALSE,FALSE,7.66E+16,66,2,1705,0,1600,1435641235
98,Sid Meier's Civilization® III Complete,33569532,english,Second best civ game before civ 6. The last update was in 2015.,1500154251,1500154251,TRUE,2,2,0.521440744,1,TRUE,FALSE,FALSE,7.66E+16,213,14,50555,34,13282,1600953760
99,Sid Meier's Civilization® III Complete,33552815,english,"My introduction to this amazing franchise was this ground breaking game over 12 years ago and i fell in love with the complexity, the intricacy, the miraid of play styles and sooooo much replay value. For its time the size, graphics, options and even the animation is very well done, and the music fis absolutely beautiful! If you want an easy place to start the Civ franchise, this is a nice easy entry point. Its still easy enough at this point for beginners to slip right in.",1500100954,1500100954,TRUE,2,0,0.523809552,0,TRUE,FALSE,FALSE,7.66E+16,33,1,31896,0,16188,1599013180
0,Sid Meier's Civilization® III Complete,33528086,english,"My favorite version of Civ. Still has the old-school look of Civ II, but adds cultural boundaries and strategic resources; nothing is more fun than getting to gunpowder, oil, uranium, etc before your enemies so you can see where the good stuff is in their territories, then start a limited resource-grabbing war (or cultural takeover!) before they realize why you want that silly little square in the desert.

The only thing I miss from this version that's not in Civ2 is the ability to create cities n mountain sectors. Nothing beats a 100% defensive bonus on a city the AI is obsessing over, spending all its resources in turn after turn of fultile attack while you conquer elsewhere.",1500006032,1500006032,TRUE,0,0,0,0,TRUE,FALSE,FALSE,7.66E+16,3079,154,2583,0,2556,1511771348
1,Sid Meier's Civilization® III Complete,33513195,english,I love Civ 3 So much. TO bad steam Butchers the  Game editor so I can have endless playability,1499984113,1499984113,TRUE,0,0,0,0,TRUE,FALSE,FALSE,7.66E+16,6,2,135,0,132,1522209824
2,Sid Meier's Civilization® III Complete,33485857,english,"Pros
-Amazing music especially in modern era
-Cute 2d graphic
-Wonders can obsolete
-Unlike civ 4,5 leader image changing in every era(example Hammurabi wear top hat with glasses in industrial era)
-Defeated leaders face.Main reason to play this game
-Regicide mode
-Sneak attack and other ai tricks
Cons
-Most types of government  is useless.
-Ai share all technology with others AI's except player.
-Ai try colonize all map!!!!
-Ai always hate player.
-Diffficult control, you must press G every time.


",1499884412,1499884412,TRUE,5,0,0.546631277,0,TRUE,FALSE,FALSE,7.66E+16,268,7,26349,0,7529,1600324737
3,Sid Meier's Civilization® III Complete,33397191,english,gud shet,1499586884,1499586884,TRUE,2,0,0.488032788,0,TRUE,FALSE,FALSE,7.66E+16,54,3,473,0,436,1501050206
4,Sid Meier's Civilization® III Complete,33338799,english,"I played Civilization V and Civilization IV, but for some reason I keep getting back to Civilization III.
It is a masterpiece that stands the test of time. It is more realistic and fun with huge maps. No religion, but best Nuclear Weapons, artillery mechanic, interface is great for me and Civilopedia is the best out of all Civilizations for me. Clear and Plain to understand.
Easy game to play, yet it is harder to master.
Advisors and Leaders change clothes, depending on which era it is. Interface is more ""realistic"" looking and not too cartonish as the newer ones. Music is outstanding.
A lot is early on about how much you expand, but it is also much easier to get steam rolled by opponents if your cities are not defended. Sometimes less better cities is more productive and efficient. Maps play a big role, and the map editor is amazing.
Diplomacy I found the most realistic of all. World war scenario can happen very quick with mutual protections. 
Never attack anyone however with open borders, they will hate you pretty much forever, lol.
If you are not the leading in technology you can still sell them to the one that have none. If you have a technology noone has, sell it to everyone (Like worldmaps) in the same turn. Extra money is great.
Governments are a very good mechanic too. Made no sense to me Civilization IV Police State with free speech.

I recommend this game to all lovers of strategy, history and nostalgic gamers.

Edit. P.S. Ignore my steam play hours, I have probably more than a thousand.",1499423234,1499423296,TRUE,2,0,0.545792997,0,TRUE,FALSE,FALSE,7.66E+16,321,15,4208,0,2687,1570275568
5,Sid Meier's Civilization® III Complete,33294254,english,"After 15 years of playing this game, it's still my favorite in the series.",1499295961,1499295961,TRUE,0,0,0,0,TRUE,FALSE,FALSE,7.66E+16,362,10,1204,0,1180,1499048371
6,Sid Meier's Civilization® III Complete,33291413,english,"Good game, CIV 5 is much better, but let's be real if you're buying this it's for some civ action on your toaster. DW This game got you.",1499289924,1499289924,TRUE,0,0,0,0,TRUE,FALSE,FALSE,7.66E+16,436,27,135,0,135,1430324329
7,Sid Meier's Civilization® III Complete,33258832,english,If you don't know what this game is this review wont help anyway.,1499225949,1499225949,TRUE,3,1,0.369403094,0,TRUE,FALSE,FALSE,7.66E+16,62,11,2040,0,800,1501460958
8,Sid Meier's Civilization® III Complete,33248349,english,I have countless more hours on the original CD until it broke. This is my favorite Civ game out there and I keep coming back to it.  There's something about this game that inspires you and is more fun than the newer ones. Perhaps it was a simpler time,1499201994,1499201994,TRUE,4,1,0.56349206,0,TRUE,FALSE,FALSE,7.66E+16,90,24,1751,0,674,1576734554
9,Sid Meier's Civilization® III Complete,33236208,english,"I was fascinated by this during my childhood, and I bought this one 'cause of the nostalgia. It's more challenging than I once thought, but hey, it's still a learning experience!",1499183410,1499183410,TRUE,1,0,0.502712488,0,TRUE,FALSE,FALSE,7.66E+16,43,9,836,0,592,1500890267
10,Sid Meier's Civilization® III Complete,33139241,english,"Nostalgia! :D
Ps. I played this game a lot more than accounted for by Steam XD",1499013070,1499180026,TRUE,3,0,0.517189264,0,TRUE,FALSE,FALSE,7.66E+16,43,31,1570,0,6,1524245616
11,Sid Meier's Civilization® III Complete,33144458,english,"I have far more hours than is visible on Steam, I would estimate over 1,000. This game was my jam as a child, and hooked me on civilization/city builder games. While it's not perfect (controls aren't as intuitive as the newer versions, and sometimes the RNG in combat seems quite off), it is a ton of fun. Between making your own modifications and various mods I obtained in the past, there is always a new game to play, or new strategy to try. With the Summer sale especially, I highly recommend this game.",1499019073,1499019073,TRUE,6,0,0.592675507,0,TRUE,FALSE,FALSE,7.66E+16,181,6,3323,0,3290,1530240230
12,Sid Meier's Civilization® III Complete,33040375,english,Amazing game. I have played countless hours of it from when I was a kid to now. It has a lot of unique characteristics that Civ 4-6 do not have. I prefer Civ 3 over the newer games any day!,1498832089,1498832089,TRUE,1,0,0,0,TRUE,FALSE,FALSE,7.66E+16,98,6,15719,2629,1644,1601841081
13,Sid Meier's Civilization® III Complete,33017787,english,"(This Review story was created on pure chance on a little map i made)

The glorious ottomen being ahead of everyone had a great Friend Named the Sumerians, one day the sumerians captured one of their citys, and had their neighbor the USA Help which didnt have boats even noticeing they have the tech to travel the world and near complete map from the ottomen of said world
The Ottomens were in shock since how they gave the sumerians tech, GOLD, and even sometimes resources/luxury products for FREE, the ottomens got the Bysentean People to declare war on the Sumerians and they convinced america to declare war on The Sumerians, Such Had Started, World War 1. The Bysentean Empire Attacked their citys in the plentiful south side of the war with the Ottomens while America.... Did Absolutely Nonthing since how weak America Was, Its kinda Supriseing how they didnt fall, the Bysiteam empire send troops to their citys to capture while the ottomen were like screw it, we dont need more citys we just need them out, lets just  Send Bomber Planes and send a few ships to other cities to bombard, The Sumerians were out numbers and were to weak to stop them and the south is the worlds most plentiful resource of the war so the Sumerians Signed a Treaty for peace to End World War 1


10/10 Would Be Suprised Again",1498785747,1498785747,TRUE,1,1,0,2,TRUE,FALSE,FALSE,7.66E+16,128,36,5605,0,1867,1570229850
14,Sid Meier's Civilization® III Complete,32995237,english,"I have probably put more time into this game than any other in my life and can call Civ III one of my all-time favorite games.

Long before Steam was a thing when Civ III was new, I spent a lot of time just playing one more turn.

Although the newer Civ games are great (Civ V, VI), the third will always be a classic to me and the one that turned me into a loyal Civ fan.

The soundtrack for this game was amazing, especially the late game music. Although it sounds very dated now, it is very well done and brings back a lot of memories.",1498749216,1498749216,TRUE,12,0,0.658773482,0,TRUE,FALSE,FALSE,7.66E+16,626,13,12671,3934,3779,1602097349
15,Sid Meier's Civilization® III Complete,32931012,english,pretty good,1498651804,1498651804,TRUE,0,0,0.420811027,0,TRUE,FALSE,FALSE,7.66E+16,84,2,355,0,236,1583706447
16,Sid Meier's Civilization® III Complete,32887218,english,"2 thumbs up, WAY up! Graphics are becoming dated but the fun isnt. Be aware that you may see a sunrise or two due to the ""just a few more turns dilemma""

I've bought this game exactly 4 times for myself. The first copy wandered off to a friend who never got around to returning it and after a while I realized I missed it too much as I walked past the""Gold"" CD version that was on sale at my local Frys which was promptly purchased. On to copy number 2, Yay! I've played that for a good long time on both Windows and Linux but finally got tired of slapping in the CD every time I wanted to play for its antiquated copy protection. Along came a Steam sale and I said 'Hello' to copy number 3. This version is slightly different than my ""Gold"" version (d*mn volcanoes) but still enjoyable as ever. Finally, just like clockwork, right after I bought #3 ran across another sale on that other game site that doesnt have any silly DRM on it in the first place and I was the proud owner of copy number 4. 

Add this :
KeepRes=1
to its own line in your ini file ""./Civilization III Complete/Conquests/conquests.ini"" to get proper widescreen support (non 4:3 aspect). This line used to be in Civ3PTW.ini but apparently got moved to this file at a later version. Depending on the version you have, this might be somewhere else too....perhaps one more directory down at ""./Civilization III Complete/Conquests/Conquests/conquests.ini""

For Linux, see WineHQ for more info on how to get the ""squaking"" bird sound to stop once it starts. The quick fix is to turn off those sounds in options but slightly less enjoyable as it removes all the environment sounds. The short of what the fix entails is you just have to replace the bird sound file with a silent version which is easy enough to craft using something like audacity.",1498596485,1498635241,TRUE,17,0,0.664438486,0,TRUE,FALSE,FALSE,7.66E+16,179,1,13,0,13,1498596397
17,Sid Meier's Civilization® III Complete,32913553,english,Best Civ game there is,1498628775,1498628775,TRUE,2,0,0.501231015,0,TRUE,FALSE,FALSE,7.66E+16,229,2,28,0,28,1345878000
18,Sid Meier's Civilization® III Complete,32840435,english,The beginning of a slow death of the Civilization series.,1498533937,1498533937,FALSE,2,0,0.188761979,1,TRUE,FALSE,FALSE,7.66E+16,521,45,721,0,721,1488839078
19,Sid Meier's Civilization® III Complete,32782432,english,"This game is great, but not as great as Civ5. It has pretty dated graphics and the leader animations are just downright ugly by today's standards. Some of the features are a little dated, too, like building roads to increase gold output and, of course, insane unit stacks. The music for the game isn't bad by the high standards of Civ, except the opening track which is so annoying I have to mute my speakers whenever it plays. 
This game, despite some of its dated features, is still a heck of a lot of fun. I relish the dated graphics as a ""retro"" Civ experience from 2001, and even the constant road-building gives your workers something to do in the later game. The ""city view,"" which disappeared in Civ4, is something that I definitely wish would've been continued, as well as the palace view. It's also nice to be able to pass through civ borders without permission like the city-state borders from civ5, although this will anger the offended nation. I got it for $1.75 on sale and considering that's it the complete edition, it's worth every penny. 
The game is fun, cheap, and has a healthy dose of retro/nostalgic feeling for those who have played the newer Civ games. Considering that you can get this for less than two dollars, I definitely recommend this purchase.",1498414038,1498414038,TRUE,26,2,0.615513027,2,TRUE,FALSE,FALSE,7.66E+16,82,14,503,0,469,1561596048
20,Sid Meier's Civilization® III Complete,32763027,english,dont bother buying this anymore get the newer ones or age of empires haha,1498381119,1498381119,TRUE,0,0,0.472042024,0,TRUE,FALSE,FALSE,7.66E+16,35,13,70,0,70,1439841088
21,Sid Meier's Civilization® III Complete,32720215,english,Fun as f,1498299307,1498299307,TRUE,0,0,0,0,TRUE,FALSE,FALSE,7.66E+16,90,3,4152,0,2654,1587668152
22,Sid Meier's Civilization® III Complete,32665676,english,"Probably the single game I've spent the most time playing over the course of my entire life. It has always been my favorite Civ since it's the one I grew up with. The music in this game is a really high point for me; each era has its own unique soundtrack that's catchy and interesting. The scenarios from Conquest are all pretty fun.

Of course this game has a huge nostalgia factor for me, so it may not be as good to newer players, but it's a great lightweight, cheaper option for an old computer or someone who wants to try a new take on Civ.",1498194523,1498194523,TRUE,2,0,0.516091764,0,TRUE,FALSE,FALSE,7.66E+16,82,6,1495,0,246,1578759766
23,Sid Meier's Civilization® III Complete,32592681,english,"Yet another game screwed to hell by Steam and it's loser companions. Game crashes after any victory,",1497966677,1497966677,FALSE,1,1,0.40438804,0,TRUE,FALSE,FALSE,7.66E+16,6,1,26434,0,1305,1598745018
24,Sid Meier's Civilization® III Complete,32511561,english,Fantastic strategy game -- definitely one of the best out there. You can spend as much time as you want in this game. There's plenty to keep you busy and engaged.,1497719606,1497719606,TRUE,9,1,0.609446943,0,TRUE,FALSE,FALSE,7.66E+16,26,5,2449,0,2449,1372307350
25,Sid Meier's Civilization® III Complete,32498875,english,"This CIV is a bit harder than the others in the series. It's a classic though. Still runs well on Windows 10.
Make sure to bring enough bombardment units to the battle or you will be wasting your time. And build roads everywhere.",1497691677,1497691677,TRUE,1,0,0.529520273,0,TRUE,FALSE,FALSE,7.66E+16,139,65,994,0,994,1495433442
26,Sid Meier's Civilization® III Complete,32382434,english,it was ok,1497337739,1497337739,TRUE,0,0,0.476190478,0,TRUE,FALSE,FALSE,7.66E+16,82,9,2555,0,267,1579507347
27,Sid Meier's Civilization® III Complete,32336408,english,"Overall a good and great story, the graphics are above it's time and even surpass today's, the story is so deep and beautiful that you will never find anything else like it. This game truly makes you question what man kind is like and how mucu we've devolved, this game only has one con that stops it from being a 10/10 but it has so many pro's so it gets a 9.9999999999999999999/10, I truly hope the one con is somehow fixed.

Pros:
Great Story
Great Graphics
Lots of gameplay 
Historically accurate
You can be Abraham Lincoln without being shot in the head.

Cons:
You can't be Hitler.

",1497166205,1497166205,TRUE,4,4,0.387685031,2,TRUE,TRUE,FALSE,7.66E+16,70,7,799,0,609,1532668949
28,Sid Meier's Civilization® III Complete,32318739,english,>that feel when you have so many stuff to manage that you take 2 hours in 1 turn,1497103957,1497103957,TRUE,0,2,0,0,TRUE,FALSE,FALSE,7.66E+16,312,6,2014,0,1537,1515429967
29,Sid Meier's Civilization® III Complete,32284821,english,"Solid gameplay, catchy soundtrack. Great price too. Would recommend it to someone looking to play a Civ game but maybe their toaster can't run Civ V.  

Only downside is the game doesn't do a great job of explaining its mechanics to newcomers, but just play it for a bit and you'll get the hang of it.
",1496990683,1496990683,TRUE,84,6,0.734089196,0,TRUE,FALSE,FALSE,7.66E+16,458,23,1963,0,1186,1574500465
30,Sid Meier's Civilization® III Complete,32179645,english,"Game maybe is interesting but I just can't play it. It's take so long to finish something good in it and the enemy is always faster and attacking me all the time, even when I give them something for peace they keep comming back. Just like today I played for 4 Hours and that 3 hours of not stop war with few nations in the same time, couldn't move troops to much to fight in other place because they keep comming for all sides all the F... time. I tryed few maps few times and noooo thx for this shit!!! Important I played on easy difficulty to learn how to play and had all the shit from game, dang!!!
Because of this I am negative to buy next part of this game I know this is old one.",1496592552,1496592552,FALSE,1,2,0.330764174,0,TRUE,FALSE,FALSE,7.66E+16,96,54,1074,0,1074,1497022756
31,Sid Meier's Civilization® III Complete,32163268,english,Extremely fun despite being an older game. Love taking over other countries. - 10/10,1496530440,1496530440,TRUE,0,0,0,0,TRUE,FALSE,FALSE,7.66E+16,56,18,3072,0,2651,1545525778
32,Sid Meier's Civilization® III Complete,32137177,english,"Ghandi decided to be a prick and wanted a shit ton of gold or he would declare war. I refused and went to war with Ghandi. I thought you were supposed to be nice man... 

10/10",1496434692,1496434692,TRUE,0,2,0,0,TRUE,FALSE,FALSE,7.66E+16,234,4,37370,0,2343,1567829337
33,Sid Meier's Civilization® III Complete,18111912,english,It is a pain in the ass getting this game to widescreen mode.,1442729860,1496356038,FALSE,0,0,0,2,TRUE,FALSE,FALSE,7.66E+16,94,43,2382,0,2382,1496198427
34,Sid Meier's Civilization® III Complete,32045779,english,"Nice slow-pace game, pretty competitive!",1496078247,1496078247,TRUE,0,0,0,0,TRUE,FALSE,FALSE,7.66E+16,56,6,6074,0,499,1556780120
35,Sid Meier's Civilization® III Complete,32044066,english,"Never had a game crashing this reliably whilst still calling it self ""complete"".",1496072571,1496072571,FALSE,2,0,0.345530003,3,TRUE,FALSE,FALSE,7.66E+16,57,1,1415,0,1365,1497846335
36,Sid Meier's Civilization® III Complete,32034591,english,9-Oct,1496031155,1496031155,TRUE,0,0,0,0,TRUE,FALSE,FALSE,7.66E+16,456,21,8971,0,7811,1564619391
37,Sid Meier's Civilization® III Complete,32003651,english,i love this game. this was the first civilization that i liked and played no stop. even today i still play it.,1495912259,1495912259,TRUE,0,0,0,0,TRUE,FALSE,FALSE,7.66E+16,55,8,113,0,94,1550443476
