,title,recommendationid,language,review,timestamp_created,timestamp_updated,voted_up,votes_up,votes_funny,weighted_vote_score,comment_count,steam_purchase,received_for_free,written_during_early_access,author.steamid,author.num_games_owned,author.num_reviews,author.playtime_forever,author.playtime_last_two_weeks,author.playtime_at_review,author.last_played
29,Sid Meier's Civilization® III Complete,18010886,english,"I enjoyed the game what has not already been said by other people.  The gameplay has a sharp learning curve and can be very simple or complicated depending on difficulty and what outcome you want to achieve.  You can destroy those that oppose you and wipe them from the face of the earth or you can be a man of peace.  It's up to you.  Compared the previous titles,  It has improved dramitically,  I have played some of the newer titles, have gone back to this one from time to time for a more simplistic gameplay.  Even if you own the newer titles honestly I would highly reccomend buying this one,  If you want a change of pace from the newer ones, or just want to see how things have changed.

Like other Civ games be careful you don't Lose track of time, because sometimes  you can get lost in the empire building.",1442128654,1442128654,TRUE,1,0,0.502712488,0,TRUE,FALSE,FALSE,7.66E+16,3029,24,1906,0,1906,1359014400
30,Sid Meier's Civilization® III Complete,17800490,english,"It was my first addictive strategy game. Then I met Victoria: An Empire Under the Sun.
It may have old graphics but a very stable and good AI and game design. 
Strong recommendation.",1440965550,1440965550,TRUE,0,0,0,0,TRUE,FALSE,FALSE,7.66E+16,69,12,168,0,142,1441745680
31,Sid Meier's Civilization® III Complete,17794480,english,"Persia. There are no other civilizations. Science? Check. Great early unit? Check. Able to wipe the floor with all others? Check. 

On a lighter note; it's good to see they did something about GameSpy dying.",1440945549,1440945549,TRUE,0,0,0,0,TRUE,FALSE,FALSE,7.66E+16,71,3,9469,0,4314,1582337590
32,Sid Meier's Civilization® III Complete,17789777,english,I bought this game without playing its prior two installments and I have to say that you wouldn't really understand or enjoy the game as it doesn't have any newbie friendly features. It has an extremely complex UI which will immediately intimidate a new player and ask if this game was worth buying in the first place.,1440926701,1440926701,FALSE,2,1,0.481832981,0,TRUE,FALSE,FALSE,7.66E+16,28,4,99,0,99,1438262068
33,Sid Meier's Civilization® III Complete,17783965,english,Was so horrible and i can't even get my money back. It hurts my eyes and it takes forever just to play a round.,1440894908,1440894908,FALSE,0,0,0,1,TRUE,FALSE,FALSE,7.66E+16,10,2,388,0,388,1436669460
34,Sid Meier's Civilization® III Complete,17731729,english,"If you want to play civ but dont have the specs to handle 5/BE, this is a must buy.",1440636252,1440636252,TRUE,0,0,0,0,TRUE,FALSE,FALSE,7.66E+16,16,1,12233,0,1063,1531019251
35,Sid Meier's Civilization® III Complete,17716977,english,Classic and great.,1440547239,1440547239,TRUE,0,0,0,0,TRUE,FALSE,FALSE,7.66E+16,112,19,2896,0,1735,1536112750
36,Sid Meier's Civilization® III Complete,17662434,english,Can't get the game working on windows 10.,1440257452,1440257452,FALSE,0,0,0,0,TRUE,FALSE,FALSE,7.66E+16,289,4,31,0,31,1440257391
37,Sid Meier's Civilization® III Complete,17576073,english,"It's an oldie but still a goodie.  Heaps of fun and grossly addictive.  If you've got a spare couple of bucks and a lot of free time, I highly recommend this.  As other reviewers have pointed out, the enemy AI in this game is a lot tougher compared to Civilization V.",1439774279,1439774279,TRUE,1,0,0.502074718,0,TRUE,FALSE,FALSE,7.66E+16,93,8,5147,0,4952,1407508280
38,Sid Meier's Civilization® III Complete,17562449,english,"screw it, its a great game, and it edumactional to",1439707205,1439707205,TRUE,2,0,0.539007068,0,TRUE,FALSE,FALSE,7.66E+16,203,35,10684,0,910,1592973731
39,Sid Meier's Civilization® III Complete,17561147,english,It crashed 3 of 3 in Windows 10 at the end of the game,1439698034,1439698034,TRUE,1,0,0.5011338,0,TRUE,FALSE,FALSE,7.66E+16,8,1,11144,0,9749,1519102797
40,Sid Meier's Civilization® III Complete,17547638,english,">Be me
>Game crashes 3 times then it works
>Be Japanese
>Create civilizations and build things around
>Lincoin came and tell me I should reward him for being the best country in the world (America)
>Tell him to take his empty threat elsewhere
>Declare war on me

11/10, would get crashes and tell him to take his empty threat elsewhere again.",1439628236,1439628806,TRUE,1,3,0.448906124,7,TRUE,FALSE,FALSE,7.66E+16,290,6,26,0,26,1439534959
41,Sid Meier's Civilization® III Complete,17509537,english,"This is my favorite game ever.  Extremeley addictive, supremely flexible.  In my opinion, the peak of the series.",1439408390,1439408390,TRUE,1,1,0.476190478,0,TRUE,FALSE,FALSE,7.66E+16,18,1,2099,0,1775,1457138545
42,Sid Meier's Civilization® III Complete,17484387,english,"Oh boy! it really shows its age but still one of the best 4x out there. So if you want an old-school-casual-strategic-chess, grab it!. Since they keep this on discount every now and then, you might want to keep it in your wishlist atleast. :)",1439278316,1439278316,TRUE,0,0,0,0,TRUE,FALSE,FALSE,7.66E+16,167,38,1496,0,1161,1433048561
43,Sid Meier's Civilization® III Complete,17445254,english,civ iii its pretty old but still an awesome game,1439050406,1439050406,TRUE,0,0,0,0,TRUE,FALSE,FALSE,7.66E+16,2,1,1928,0,1621,1511991129
44,Sid Meier's Civilization® III Complete,17437145,english,"Refuses to start at 1080p, even with KeepRes=1.

Adds a few tricks to civ 2, but not as good as Alpha Centauri.  

Game is buggy, not their best work.",1438997913,1438997913,FALSE,0,0,0,0,TRUE,FALSE,FALSE,7.66E+16,61,1,42879,0,2353,1598494764
45,Sid Meier's Civilization® III Complete,17408431,english,I grew up playing this game and lost the disk years ago. This game has aged very well and I would recomend it to anybody who likes the Civilization franchise or strategy games in general,1438827944,1438827944,TRUE,0,0,0,0,TRUE,FALSE,FALSE,7.66E+16,297,20,29467,0,3437,1595541142
46,Sid Meier's Civilization® III Complete,17395478,english,"It's like eating pie, but better",1438759932,1438759932,TRUE,2,0,0.502371192,0,TRUE,FALSE,FALSE,7.66E+16,435,51,2326,0,2326,1360310400
47,Sid Meier's Civilization® III Complete,17380588,english,"5/5, 10/10, 5 Stars, A+++, This is my all time favourite strategy game, I still play it regularly. Best of the Civ series!",1438682864,1438682864,TRUE,1,0,0.481927723,0,TRUE,FALSE,FALSE,7.66E+16,283,9,39605,0,14491,1600227002
48,Sid Meier's Civilization® III Complete,17372963,english,I have spent years playing this game. Classic.,1438635195,1438635195,TRUE,1,1,0.481927723,0,TRUE,FALSE,FALSE,7.66E+16,77,5,9604,0,9599,1548264866
49,Sid Meier's Civilization® III Complete,17316038,english,"I have the games on hard disk got them when they first came out. Love this game so much that I bought the steam version, and to my amazment it seems to play smoother then the disk version. To me this game is better then the newer ones. I still play this game to this day. well worth the fiver I spent to get the steam version.",1438351226,1438351226,TRUE,35,3,0.777038574,0,TRUE,FALSE,FALSE,7.66E+16,1693,47,58446,1998,1927,1601340725
50,Sid Meier's Civilization® III Complete,17282654,english,"I got this game on steam sale for 2.95 and of cause I ended up spenting 62 hours playing it.

You will come to the point where you will betrade a another civ and learn to hate a another.

you will go mad with power, trying to get the last resoures or trying to get new land for your people.

one war can lead to a world war.

you want the gold but you also want to have a power army.

you do what ever it take to be the almighty.

10/10",1438180985,1438180985,TRUE,4,0,0.4938353,0,TRUE,FALSE,FALSE,7.66E+16,34,4,7649,0,3634,1578859760
51,Sid Meier's Civilization® III Complete,17236685,english,"Never have 128 hours passed so quickly. This game is incredible in that every playthrough is a new experience. For those looking for a short game: look elsewhere. For those who love hours of grinding through turn-based strategy excellence, you have come to the right place,",1437920747,1437920747,TRUE,13,1,0.599010766,0,TRUE,FALSE,FALSE,7.66E+16,15,2,40554,0,7418,1586865557
52,Sid Meier's Civilization® III Complete,17229459,english,Very fun.,1437873620,1437873620,TRUE,0,0,0.481927723,0,TRUE,FALSE,FALSE,7.66E+16,68,7,1811,0,1721,1520901153
53,Sid Meier's Civilization® III Complete,17184470,english,"Love the game, but the combat part is fucking ridiculous. A riflemen getting beat by a spearman happens too often for me to recommend this game.",1437638349,1437638349,FALSE,9,2,0.488150895,0,TRUE,FALSE,FALSE,7.66E+16,17,1,1577,0,1576,1455914232
54,Sid Meier's Civilization® III Complete,17132422,english,I don't know if this is a good or bad game; all I know is that the tutorial currently doesn't work and that makes it impossible to learn.,1437348752,1437348752,FALSE,6,1,0.446659714,0,TRUE,FALSE,FALSE,7.66E+16,77,7,9,0,9,1437345788
55,Sid Meier's Civilization® III Complete,17132127,english,11/10 would have Gandhi suprise attack me with nuclear subs again,1437347081,1437347081,TRUE,66,170,0.69833988,3,TRUE,FALSE,FALSE,7.66E+16,178,1,4964,0,3574,1438900507
56,Sid Meier's Civilization® III Complete,17093038,english,i own the game but i would not recomend it to anyone buy the second one instead i hate the fact that my citys have civil disorder all the time my troops fail to kill anything even of the easiest difficulty,1437146497,1437146497,FALSE,0,0,0,0,TRUE,FALSE,FALSE,7.66E+16,120,5,1167,0,935,1461323798
57,Sid Meier's Civilization® III Complete,17085835,english,"My only experience with the Civilization franchise prior to this was the original, which I played in DOSBox. This game has many more features and is very enjoyable, plus there are many custom maps and mods thanks to a surprisingly active community (civfanatics).

Overall, this is a great game, even by today's standards, and is definetly worth the purchase at $4.99 (when I bought it).",1437100605,1437100605,TRUE,0,1,0,0,TRUE,FALSE,FALSE,7.66E+16,19,3,781,0,747,1437255606
58,Sid Meier's Civilization® III Complete,17074343,english,"One of my favorite games from my childhood , and it still holds up after nearly a decade and a half.
I was going to rebuy a physical copy because I lost my old one only to pick this up for $5 a few years back.
Its just as rewardingly difficult as ever , and I wouldn't have it any other way.",1437044522,1437044522,TRUE,0,0,0,0,TRUE,FALSE,FALSE,7.66E+16,203,7,8678,0,7660,1600556890
59,Sid Meier's Civilization® III Complete,17021656,english,"Experience hours of classic Civ, with all the dlc included, and its only 5 bucks??? BUY IT ALREADY!!!!!!",1436762084,1436762084,TRUE,0,0,0,0,TRUE,FALSE,FALSE,7.66E+16,163,26,10903,0,2404,1543897878
60,Sid Meier's Civilization® III Complete,16922557,english,Fun game and a small upgade over civ 2,1436256635,1436256635,TRUE,0,0,0,0,TRUE,FALSE,FALSE,7.66E+16,57,2,1524,0,998,1529560323
61,Sid Meier's Civilization® III Complete,16856067,english,"I was playing as the Japanese. I was doing quite swell in my game, but I lost the whole game after the Byzantines declared war on me because there army captured one of my cities. To my comlete suprise, I was eliminated from the game due to something I forgot to change in the victory conditions menu; I forgot that I had the elimination setting set to if I lost 1 city, I would lose the game. I even forgot that the elimination setting was on in the first place.",1435904921,1435904921,TRUE,0,0,0,0,TRUE,FALSE,FALSE,7.66E+16,162,4,2820,0,1660,1598648873
62,Sid Meier's Civilization® III Complete,16825157,english,"80/100
I was  purchasing new games and when i bought games,i noticed i have extra money.Then i saw this game and buy it.I thought it was a mediocre game.I said ''Let's try!I have nothing to lose.''.I lost my hours.That game is addicting.",1435750717,1435750717,TRUE,2,0,0.521739125,0,TRUE,FALSE,FALSE,7.66E+16,43,8,804,0,505,1544116066
63,Sid Meier's Civilization® III Complete,16784106,english,I used to play this years ago and bought the whole franchise on steam and love it all over again. Reacquainted myself with this one before delving into IV and V. A little different from Civilization Revolution that I've gotten used to on Xbox but still great.,1435601648,1435601648,TRUE,0,0,0,0,TRUE,FALSE,FALSE,7.66E+16,108,2,4601,925,2456,1601192289
64,Sid Meier's Civilization® III Complete,16776400,english,"Now the Aztecs are stomping on the Spanish.

10/10 Would re-write history again.",1435567619,1435567619,TRUE,0,0,0.415797055,0,TRUE,FALSE,FALSE,7.66E+16,471,18,12,0,12,1435136705
65,Sid Meier's Civilization® III Complete,16768800,english,One of the best old school game.,1435527489,1435527489,TRUE,1,0,0.523809552,0,TRUE,FALSE,FALSE,7.66E+16,120,11,8236,0,1806,1568234024
66,Sid Meier's Civilization® III Complete,16751779,english,"Classic game, all around fun. possibly 700+ hours of my life wasted on this game off and on steam.
",1435456438,1435456438,TRUE,0,0,0,0,TRUE,FALSE,FALSE,7.66E+16,271,14,17243,0,11798,1597038256
67,Sid Meier's Civilization® III Complete,16751017,english,Best strategey game ever.,1435452142,1435452142,TRUE,2,1,0.523809552,0,TRUE,FALSE,FALSE,7.66E+16,23,3,13036,0,5810,1577245887
68,Sid Meier's Civilization® III Complete,16738766,english,"Probably my favourite of the Civilization series! An oldie but a goodie. It's simpler than Civ IV, and still has loads to do. Plus it's based on the old square tile system instead of the hexagonal system, which is great for if you're not used to turn-based strategy gameplay. Finally, this game has absolutely wonderful music that doesn't get old. Especially when you hit the modern era and end up watching 100+ bombers blow the countryside to smithereens.",1435407402,1435407402,TRUE,0,0,0,0,TRUE,FALSE,FALSE,7.66E+16,479,10,1245,0,904,1527203789
69,Sid Meier's Civilization® III Complete,16730351,english,"I've logged in many hours on this game [pre-steam], must be in the hundreds of hours, excellent strategy game from along time ago. 10/10",1435365358,1435365358,TRUE,0,0,0,0,TRUE,FALSE,FALSE,7.66E+16,306,16,841,0,119,1597881432
70,Sid Meier's Civilization® III Complete,16729588,english,"A poor job was done of updating this classic for Steam.  The game works, but a lot of the in game text messages are screwed up.  I ended up installing the original versions of Civ 3, PtW and Conquests, from my cd's, over top of the game, and using a hacked version of the Conquests executable to get everything working properly.  So the $10 Canadian I spent on this was basically wasted.",1435361617,1435361617,FALSE,0,0,0,0,TRUE,FALSE,FALSE,7.66E+16,30,3,695,0,442,1447019120
71,Sid Meier's Civilization® III Complete,16709489,english,"From the very beginning, every mainline edition of the Civilization series has gotten an average of a 90-95% user approval rate which is a greater approval rate than that normally ascribed to civilization itself. This could be due to the fact that the Civilization seies simply soars while civilization itself seems to soar and stink in equal measure. Then again, it could be that the game of Civilization simply appeals to the inner narcissist lurking somewhere within us all. After all, how often is it you can be elected ruler of your nation by popular acclaim, rule them in a governmental form of your choice, eventually rise to rule to world, establish Earth's first off world colony, and live for centuries. I have to admit that is slightly more ambitious than my own real world expectations, but I do have an eye on the North American continent. Consider yourself warned.

Now don't get me wrong here. I am not trying to say that Civilization is the best turn based, civ building, strategy game ever. That would be unfair to all those games I have not gotten around to trying. What I can say is that it is by far the best I have ever played, and narcissist that I am, I will try most anything that gives me a shot at world domination.

The Civilization series is up to Civ-5 at this point, but Civ-3 is a game which endures the times, remains comparable to like games of more recent production, and holds a special place in my heart when compared to the newer versions of this long running classic. Later editions of this game introduce elements which alter the play style and base strategy of the game, but while I believe that Civ-4 & 5 remain true to the original construct to a large degree, it is Civ-3 which most closely  resembles the original. In fact, it is exactly like the original, but with greater user options, and smoother game play. 

If you have been thinking about giving this series a try, Civ-3 is a great place to start. With the release of Civ-5, the Steam price for Civ-3 is a mere $5.00 which in my opinion makes it one of the best bargains in the entire Steam Library. Just one run through of this game will keep you occupied for longer than the run time of a long movie, and when was the last time you got into a movie theatre for &5.00 eh? I began playing this game when it first came out for PC in the 90's, continue to play it to this day, and played Civ-1 & 2 before that. How's that for a testament for long term replayability? I simply could not recommend another game of this type more highly.",1435276529,1435276529,TRUE,0,1,0,0,TRUE,FALSE,FALSE,7.66E+16,105,3,271559,6293,7880,1601361531
72,Sid Meier's Civilization® III Complete,16698952,english,"Play as Aztecs, enslave africans, destory america, Invade the spainards, midway to mass genocide the native americans to secure my spot as the only empire, get killed by disease 10/10",1435242284,1435242284,TRUE,0,0,0,0,TRUE,FALSE,FALSE,7.66E+16,101,7,6202,0,1415,1552110920
73,Sid Meier's Civilization® III Complete,16649699,english,"I hate bug... F**k you

-125447785422547854122547551123/10 for f**king bug",1435070926,1435070926,FALSE,1,1,0.423675448,0,TRUE,FALSE,FALSE,7.66E+16,178,4,438,0,438,1435910879
74,Sid Meier's Civilization® III Complete,16634344,english,"One of the deepest Civilization games to date, but very difficult if you're not sure what to do. It's cheap, try it out. Lots of replayability.",1435018174,1435018174,TRUE,0,0,0,0,TRUE,FALSE,FALSE,7.66E+16,79,5,690,0,545,1593313414
75,Sid Meier's Civilization® III Complete,16588972,english,An Aztec spearman beat my tank: 11/10,1434906925,1434906925,TRUE,0,1,0,0,TRUE,FALSE,FALSE,7.66E+16,128,30,224,0,100,1435088811
76,Sid Meier's Civilization® III Complete,16559663,english,"This game has, by far, taken more of time than any other.  In fact I am on my fourth, hopefully final, copy of it.  I orignally was gifted a 3 part CD version of the game from a neighbor who never was into computer games and did not want it.  I played CIV3 nonstop, I would sit in class fantasizing about the game, I would go to sleep dreaming about the game and I still to this day reminisce about specific games I had played close to ten years ago.  I was so hooked that my father took the discs and snapped them in half.  Months of stellar behavior later I managed to earn another copy on my birthday, which was quickly destroyed a month later due to an average of ten hours a day, and 16 hours on the weekend.  I was able to get another disc copy without my parents knowing but I could not control my addiction, causing them to find out about my new copy and promptly destorying it.  Now, able to do things on my own, I bought my latest version on steam for no other reason that I do not feel complete without knowing I have it.  Honestly, this game does not play as well as CIV5 but if you are looking for a changeup, buy it.",1434823052,1434823052,TRUE,1,2,0.511767924,0,TRUE,FALSE,FALSE,7.66E+16,57,5,8061,0,4151,1596049543
77,Sid Meier's Civilization® III Complete,13918681,english,"General - 8.0
Sid Meier's Civilization is one of the greatest game franchises ever, it's a landmark for every turn-based strategy game. The name itself tells what the game is about, you pick one civilization, select a location to start, select CPU controlled civilizations and settings for that specific map. Your job is to make your civilization meet any of the victory conditions, which can be through science, military, culture, diplomacy, points, etc. The first game of the series I played was Civ II, back in 2001, which instantly made me a fan since then. However I skipped Civ III at its time, and that is what made me buy it many years later. I paid around 1USD for the game just to see what I missed, and unfortunately, not much. Don't get me wrong, it's a great game, but if you played Civ IV, in my opinion, there is nothing in Civ III that will be better than in the later game. It's only worth playing for saudosism purposes. It's heavily outdated.

Content - 8.5
Steam version is a complete version, which includes both expansion packs released. You have a vast number of civilizations to pick and you can adjust some major settings for a location, like temperature, umidity, geological era, water level, etc. You can also chose the victory conditions for a game, which you can fit into your play style, along with difficulty level. The Civilopedia is a tool of great educational value, it contains real data about the civilizations, technologies, unities and almost everything you can find in the game. There is a highest scores table too, but I believe it only displays single-player scores. I don't know if steam is providing some sort of multiplayer support at this time.

Gameplay - 4.0
Like most Civ games, you start with a settler, a worker and/or a warrior in most cases, from this you have to build your city and administer it's growth with the resources gathered around it, which can be selected in the city radius. Each unity you create in a city has a better use, and through the years (turns), as long as your cities and citizens are productive you'll eventually discover technologies which improve your unities and your cities buildings. You can focus your whole civilization in a few aspects or diversify your knowledge. Every civilization on the map have it's own personality and choices, from warmongers to pacifists. What you have to do is to secure your civilization a place in history. But why I give 4.0? It won't help you get started at all. I'm not asking for a strategy guide, I just wanna learn the basics of the game, what's unique to it, what options I have and what they do. I couldn't find a tutorial or at least a checkbox to display tooltips, even the options in the main menu don't have a basic description. It's one of the less intuitive game I've ever seen, unlike it's predecessor ou sucessor. Of course after sometime you'll start to get used to the controls, but they still feel weird. The UI is not friendly even for games older than it is, Age of Empires II is older and has a much more friendly interface and controls.

Graphics - 2.5
The game looks very bad even for its generation, Age of Wonders and Medieval Total War had much better visual quality. Civilization III looks so bad that if affects gameplay, you need to often take a closer look to identify some terrains and unities. There are no options for good graphic enhancements, you can not adjust resolution, it's based on desktop resolution, and even tweaking can't get satisfactory results. I know it's an old game, but the ones I cited are old too and are from the same genre. At least the game showed an improvement compared to the previous title, texture quality is better and there are movement animations for the unities.

Overall - 5.8

Current specs
Intel Core I7-4770K at 4.2ghz
Nvidia PNY GTX 770 2gb at 1201mhz
Kingston HyperX DDR3 8gb at 1600mhz (x2)
HP 1TB SATA III 7200rpm
Windows 7 Premium SP1
Sony Bravia KDL-42W655A at 1080p",1420861818,1434778343,FALSE,6,3,0.386191159,20,TRUE,FALSE,FALSE,7.66E+16,130,2,87,0,33,1448157449
78,Sid Meier's Civilization® III Complete,16515100,english,You know you have played a game too much when you have the music memorized.,1434685843,1434685843,TRUE,36,18,0.754291654,0,TRUE,FALSE,FALSE,7.66E+16,123,27,5089,0,3529,1476555332
79,Sid Meier's Civilization® III Complete,16498406,english,Write a review for Sid Meier's Civilization® III,1434636377,1434636377,TRUE,1,2,0.493278563,0,TRUE,FALSE,FALSE,7.66E+16,573,74,90,0,89,1590186957
80,Sid Meier's Civilization® III Complete,16480986,english,Everytime I try to make an alliance I get stabed in the back... 10/10,1434573009,1434573009,TRUE,0,0,0,0,TRUE,FALSE,FALSE,7.66E+16,36,13,976,0,449,1550003601
81,Sid Meier's Civilization® III Complete,16425199,english,"A fun game, there is a bit of a learning curve for new players. I also wish they had Steam Achievements for this game, but its fine without them.",1434395199,1434395199,TRUE,4,0,0.511694133,0,TRUE,FALSE,FALSE,7.66E+16,125,2,633,0,228,1597804565
82,Sid Meier's Civilization® III Complete,16406164,english,10/10 would qeeuf again,1434334150,1434334150,TRUE,0,0,0.441291004,0,TRUE,FALSE,FALSE,7.66E+16,54,3,4873,0,1993,1505179912
83,Sid Meier's Civilization® III Complete,16404797,english,"I love this game because the theme the choice every move counts moving this one regular spearmen (while in the future tech research) here could effect the game nine turns later resulting in the fall of your country/nation so every choice counts and the maps you can play the units the ""mods"" (air qotations) or sonarios installed with the game adds research from the fan commitie when this game first game out and they were on websites so i give this game a 8.2/10",1434328598,1434328598,TRUE,1,1,0.480776131,0,TRUE,FALSE,FALSE,7.66E+16,48,12,5784,0,4696,1569120056
